EN URL,DE URL,EN Meta Title,EN Meta Description,DE Meta Title,DE Meta Description,EN Status,DE Status
"https://www.rapturecamps.com/blog/what-to-expect-from-surfing-classes/",,"What To Expect From Surfing Classes · Rapture","From basic techniques to surfing etiquette, we’ll walk you through what you can expect from surfing classes.",,,"Published","Missing"
"https://www.rapturecamps.com/blog/from-our-surf-house-in-ericeira-paddle-to-purpose/","https://www.rapturecamps.com/de/blog/aus-unserem-surf-haus-in-ericeira-paddle-to-purpose/","From our surf house in Ericeira: Paddle to Purpose · Rapture","Coming soon to our surf house in Ericeira - a film by Daniela Kohler about paddling surfing, staying true to yourself and getting out of your comfort zone.","Aus unserem Surf-Haus in Ericeira: Paddle to Purpose · Rapture","Ein Film von Daniela Kohler über das Paddel-Surfen, sich selbst treu zu bleiben und aus der Komfortzone herauszukommen. Eine Reise zu Sinnfindung.","Draft","Published"
"https://www.rapturecamps.com/blog/from-our-surf-house-in-ericeira-paddle-to-purpose/","https://www.rapturecamps.com/de/blog/aus-unserem-surf-haus-in-ericeira-paddle-to-purpose/","From our surf house in Ericeira: Paddle to Purpose · Rapture","Coming soon to our surf house in Ericeira - a film by Daniela Kohler about paddling surfing, staying true to yourself and getting out of your comfort zone.","Aus unserem Surf-Haus in Ericeira: Paddle to Purpose · Rapture","Ein Film von Daniela Kohler über das Paddel-Surfen, sich selbst treu zu bleiben und aus der Komfortzone herauszukommen. Eine Reise zu Sinnfindung.","Published","Published"
"https://www.rapturecamps.com/blog/goofy-foot-surfing/",,"Goofy Foot Surfing: What It Means And How It · Rapture","A regular stance means your left foot leads, while a goofy stance positions your right foot forward. About 30% to 40% of surfers ride goofy.",,,"Published","Missing"
"https://www.rapturecamps.com/blog/high-surf-warnings/",,"High Surf Warnings: Everything You Need To Know · Rapture","A high surf warning is an alert issued when breaking wave action poses a threat to life and property within the surf zone.",,,"Published","Missing"
"https://www.rapturecamps.com/blog/10-biggest-waves-ever-surfed/","https://www.rapturecamps.com/de/blog/geschichte-macher-die-10-groessten-jemals-gesurften-wellen/","History Makers: 10 Biggest Waves Ever Surfed · Rapture","Discover the Biggest Waves Ever Surfed. Learn about Nazare, Jaws, Mavericks, Cortes Bank, Teahupo'o & 5 more monster waves!","Geschichte-Macher: Die 10 größten jemals gesurften Wellen · Rapture","Entdecke die größten Wellen, die je gesurft wurden. Erfahre mehr über Nazare, Jaws, Mavericks, Cortes Bank, Teahupo'o und 5 weitere Monsterwellen!","Published","Published"
"https://www.rapturecamps.com/blog/how-do-tides-work/",,"How Do Tides Work? Understanding The Ocean's · Rapture","Tides, the result of the sun and moon's gravitational pull, shape the waves that surfers seek. Find out more!",,,"Published","Missing"
"https://www.rapturecamps.com/blog/how-fast-do-surfers-go/",,"How Fast Do Surfers Go? · Rapture","Surfers typically progress to speeds around 10-15 mph. Advanced surfers, on the other hand, often reach impressive speeds of 15-20 mph!",,,"Published","Missing"
"https://www.rapturecamps.com/blog/how-many-calories-do-you-burn-surfing/","https://www.rapturecamps.com/de/blog/wie-viele-kalorien-verbrennt-man-beim-surfen/","How Many Calories Do You Burn Surfing? · Rapture","A 150-pound surfer might burn anywhere from 100 to over 250 calories per hour, depending on wave conditions and intensity.","Wie viele Kalorien verbrennt man beim Surfen? · Rapture","Ein 68 Kilogramm schwerer Surfer könnte je nach Wellenbedingungen und Intensität zwischen 100 und über 250 Kalorien pro Stunde verbrennen.","Published","Published"
"https://www.rapturecamps.com/blog/how-many-shark-attacks-per-year/",,"How Many Shark Attacks Per Year: It's Less Than · Rapture","In 2023, there were only 69 confirmed unprovoked shark attacks globally. This number pales in comparison to other ocean-related risks.",,,"Published","Missing"
"https://www.rapturecamps.com/blog/how-to-capture-surf-photography/",,"How To Capture Stunning Surf Photography · Rapture","Aspiring surf photographer? From choosing the best camera to tips for keeping safe, we cover everything for capturing the best surf photos.",,,"Published","Missing"
"https://www.rapturecamps.com/blog/choosing-beginner-surfboards/",,"How To Choose A Surfboard For Beginner Surfers? · Rapture","Calling all beginner surfers! Discover the best surfboards for newbies and start catching waves with confidence. Read on!",,,"Published","Missing"
"https://www.rapturecamps.com/blog/the-perfect-surf-shorts/",,"How To Choose The Perfect Surf Shorts · Rapture","In this guide, we’ll dive into what makes a good pair of surf shorts stand out and how to pick the best pair for your needs.",,,"Published","Missing"
"https://www.rapturecamps.com/blog/arenal-volcano/","https://www.rapturecamps.com/de/blog/arenal-vulkan-wanderung-die-besten-trails-tipps/","How To Hike Arenal Volcano: Best Trails & Tips · Rapture","Standing at 5,437 feet, Arenal volcano provides a combination of trails, wildlife, and panoramic views that showcase Costa Rica's beauty.","Arenal Vulkan Wanderung: Beste Trails & Tipps · Rapture","Mit 1.657 Metern Höhe bietet der Arenal Vulkan eine Kombination aus anspruchsvollen Wegen, Tierwelt und Panoramablicken, die die Schönheit Costa Ricas zeigen.","Published","Published"
"https://www.rapturecamps.com/blog/how-to-take-wax-off-a-surfboard/",,"How To Take Wax Off A Surfboard: A Step-by-Step · Rapture","Master surfboard wax removal with our expert tips! Learn tools, techniques, and eco-friendly solutions for a board ready to hit the waves.",,,"Published","Missing"
"https://www.rapturecamps.com/blog/costa-rica-on-a-budget/",,"How To Travel Costa Rica On A Budget · Rapture","Can you explore Costa Rica on a budget? From low price accommodation to free daily activities, we cover the best way to explore this paradise without breaking the bank.",,,"Published","Missing"
"https://www.rapturecamps.com/blog/how-to-wax-a-surfboard/","https://www.rapturecamps.com/de/blog/wie-man-ein-surfbrett-wachst/","How To Wax A Surfboard: Step-by-Step Guide · Rapture","Before you start, gather your supplies: base coat wax, top coat wax, a wax comb, wax remover or scraper, and a clean cloth.","Wie man ein Surfbrett wachst: Eine Schritt-für-Schritt-Anleitung · Rapture","Bevor Sie beginnen, sammeln Sie Ihre Utensilien: Grundwachs, Deckwachs, einen Wachskamm, Wachsentferner oder Schaber und ein sauberes Tuch.","Published","Published"
"https://www.rapturecamps.com/blog/how-to-choose-the-best-surfboard/",,"Choosing a Surfboard: 5 Things To Consider · Rapture","Don't make a hasty choice when it comes to your surfboard. Here are 5 important factors to keep in mind to find the perfect board for you.",,,"Published","Missing"
"https://www.rapturecamps.com/blog/the-perfect-surfboard-in-bali/",,"How to Choose the Perfect Surfboard in Bali · Rapture","Wondering how to choose the perfect board for your trip to Bali? Learn how you can make the best purchase for your next surfing adventure.",,,"Published","Missing"
"https://www.rapturecamps.com/blog/how-to-choose-the-right-surfboard-for-you/",,"How to Choose the Right Surfboard for You · Rapture","Choosing the perfect surfboard can be overwhelming, but don't worry! Our expert tips and advice will help you make the right decision.",,,"Published","Missing"
"https://www.rapturecamps.com/blog/how-to-cutback-a-surfers-guide/",,"How to Cutback: A Surfer’s Guide · Rapture","A cutback in surfing is a move where the surfer turns the board back toward the wave's breaking part, usually in a smooth, arcing motion.",,,"Published","Missing"
"https://www.rapturecamps.com/blog/how-to-style-like-a-surfer-rapturecamps/",,"Surfer Style Guide: 12 Tips To Nail Your Look · Rapture","Style like a surfer with these 12 tips. Helpful advice on dressing, behaving and enjoying life like a true surfer guy or girl.",,,"Published","Missing"
"https://www.rapturecamps.com/blog/beginners-guide-to-surfing-in-portugal/","https://www.rapturecamps.com/de/blog/anfaenger-leitfaden-zum-surfen-in-portugal/","Master the Waves in Portugal: A Beginners Guide · Rapture","From year-round waves and a variety of breaks, discover why Portugal Is the perfect destination for beginner surfers.","Meistern Sie die Wellen in Portugal: Ein Leitfaden für Anfänger %%sepe% · Rapture","Von ganzjährigen Wellen und einer Vielzahl von Breaks, entdecken Sie, warum Portugal das perfekte Reiseziel für Surfanfänger ist.","Published","Published"
"https://www.rapturecamps.com/blog/8-steps-on-how-to-pop-up-on-a-surfboard/","https://www.rapturecamps.com/de/blog/wie-du-dein-surfbrett-pop-up-perfektionierst/","How to Pop Up on a Surf Board: 8 Easy, Doable · Rapture","Master the art of popping up on a surfboard with this step-by-step guide. Get ready to catch some epic waves!","Pop-up auf dem Surfbrett: Einfach erklärt · Rapture","Meistere das Pop-up auf dem Surfbrett mit unserem Schritt-für-Schritt-Leitfaden. Mach dich bereit, epische Wellen zu fangen!","Published","Published"
"https://www.rapturecamps.com/blog/how-to-plan-your-surf-trip-to-morocco/",,"Surf Trip to Morocco: Visa, Surf Spots, Language · Rapture","We will help you with planning your next surf trip to Morocco with a simple list of recommendations so you can travel safely and comfortably.",,,"Published","Missing"
"https://www.rapturecamps.com/blog/how-to-read-a-surf-report-unlocking-the-secrets-of-a-great-day-to-surf/","https://www.rapturecamps.com/de/blog/wie-man-einen-surfbericht-liest-die-geheimnisse-entdecken-um-die-beste-zeit-zum-surfen-zu-finden/","Surf Forecast: Finding the Perfect Break for Your · Rapture","Learn how to read a surf forecast and find the ideal break for your skill level with this comprehensive guide for every level of surfer.","Surfvorhersage | Finde den perfekten Spot für dein Können · Rapture","Lerne, wie du eine Surfvorhersage liest und den idealen Surfspot für dein Können findest mit diesem umfassenden Leitfaden für Surfer aller Level.","Published","Published"
"https://www.rapturecamps.com/blog/how-to-read-a-surf-report/",,"How to Read a Surf Report: Know the Basics · Rapture","Learning how to read a surf report is the first step in becoming a confident surfer. Read on to know about the essential elements of it.",,,"Published","Missing"
"https://www.rapturecamps.com/blog/how-to-surf-barrel-riding-tips/",,"How to Surf : Barrel Riding Tips",,,,"Draft","Missing"
"https://www.rapturecamps.com/blog/5-best-surfers/",,"Icons of the Ocean: Profiles of 5 Legendary · Rapture","From the 1960s all the way to 2024, we name five legendary surfers that have left their mark on every beach their boards have graced.",,,"Published","Missing"
"https://www.rapturecamps.com/blog/surfing-in-seminyak/",,"Surfing in Seminyak: Indonesia Surf Scene · Rapture","Get ready for epic Bali surf sessions in Seminyak. Don't miss out and discover the thrill of riding the waves, start your surf journey today!",,,"Published","Missing"
"https://www.rapturecamps.com/blog/surf-ekas-bay/",,"Important Things to Know When Surfing Ekas Bay · Rapture","Discover the thrill of surfing in Ekas Bay, one of the best surfing destinations in Indonesia! Get ready to experience crowd-free waves!",,,"Published","Missing"
"https://www.rapturecamps.com/blog/is-bali-safe-for-solo-female-travellers/",,"Is Bali Safe For Solo Female Travellers? · Rapture","Bali is regarded as one of Indonesia's safest tourist destinations. The island sees millions of visitors annually (including countless solo female travellers).",,,"Published","Missing"
"https://www.rapturecamps.com/blog/is-surfing-hard/","https://www.rapturecamps.com/de/blog/ist-surfen-schwer/","Is Surfing Hard? · Rapture","Is surfing hard? Yes, it can be. But like any worthwhile pursuit, the difficulties are part of what makes it so satisfying!","Ist Surfen schwer? · Rapture","Ist Surfen schwer? Ja, das kann es sein. Aber wie bei jeder lohnenden Beschäftigung sind die Schwierigkeiten ein Teil dessen, was es so befriedigend macht!","Published","Published"
"https://www.rapturecamps.com/blog/jaco-costa-rica/",,"Jaco, Costa Rica: A Surfer’s Guide To The Best · Rapture","Jaco has evolved from a sleepy fishing village into a vibrant surf town that draws wave chasers from around the globe. Find out more!",,,"Published","Missing"
"https://www.rapturecamps.com/blog/surf-school-nicaragua/","https://www.rapturecamps.com/de/blog/surfschule-nicaragua/","Is this the right surf school in Nicaragua for · Rapture","Discover the perfect waves and expert instructors at the top-rated surf school. Surf Nicaragua like a pro!","Surfschule Nicaragua · Rapture","Lernen Sie Surfen oder verbessern Sie Ihr Können im tropischen Paradies! Kommen Sie in unsere Surfschule in Nicaragua und genießen Sie ganzjährig perfekte Wellen und ablandige Winde.","Published","Published"
"https://www.rapturecamps.com/blog/what-to-look-for-in-costa-rica-hotels/","https://www.rapturecamps.com/de/blog/strandhotels-in-costa-rica-worauf-du-unbedingt-achten-solltest/","Key Features to Look for in Costa Rica Beachfront · Rapture","With so many options to choose from along Costa Rica's coasts, how do you find the perfect beachfront hotel for your surfing getaway?","Die wichtigsten Merkmale der Strandhotels - Costa Rica · Rapture","Wie findest du bei der großen Auswahl an Costa Ricas Küsten das perfekte Strandhotel für deinen Surftrip?","Published","Published"
"https://www.rapturecamps.com/blog/learn-how-to-duck-dive/",,"LEARN HOW TO DUCK DIVE",,,,"Draft","Missing"
"https://www.rapturecamps.com/blog/la-paz-waterfall-gardens/",,"La Paz Waterfall Gardens: Costa Rica’s Most · Rapture","La Paz Waterfall Gardens offers 5 cascading waterfalls through a pristine cloud forest. We cover everything there is to know about La Paz.",,,"Published","Missing"
"https://www.rapturecamps.com/blog/learn-how-to-read-the-surf-forecast/",,"Learn How to Read the Surf Forecast",,,,"Draft","Missing"
"https://www.rapturecamps.com/blog/the-languages-of-indonesia/",,"Learn The Lingo: The Languages Of Indonesia · Rapture","With over 700 languages spoken across its 17,000 islands, how do you decide which of these Indonesian languages is the best to learn?",,,"Published","Missing"
"https://www.rapturecamps.com/blog/beginner-surfer-tips/",,"8 Surfing Tips For Beginners: Learn To Surf · Rapture","Ready to catch your first wave? Our beginner's guide to surfing provides all the tips and techniques you need to learn to surf like a pro!",,,"Published","Missing"
"https://www.rapturecamps.com/blog/surf-school-bali/","https://www.rapturecamps.com/de/blog/surfschule-bali/","Best Surf Camp in Bali: Surf Lessons with · Rapture","Ready to learn how to surf in paradise? Choose the premier surf camp in Bali. Get ready for an incredible surfing experience!","Surfschule Bali – Vom Anfänger bis zum Profi · Rapture","Du willst surfen lernen, bist aber nicht sicher, wohin es gehen soll? Besuche unsere Surfschule auf Bali und bezwinge in kürzester Zeit deine erste Welle!","Published","Published"
"https://www.rapturecamps.com/blog/learn-to-surf-in-costa-rica-a-beginner-s-guide/",,"Learn to surf in Costa Rica: a beginner's guide",,,,"Draft","Missing"
"https://www.rapturecamps.com/blog/beginners-guide-to-surfing/","https://www.rapturecamps.com/de/blog/surfen-lernen-ein-leitfaden-fuer-anfaenger-zum-meister-im-surfen/","Learning to Surf: A Beginners Guide to Surfing · Rapture","From safety tips to planning your first surf trip, we’ve got you covered to help transition you from a surfing novice to riding those waves with stoke.","Surfen lernen: Ein Leitfaden für Anfänger zum Meister im Surfen · Rapture","Von Sicherheitstipps bis hin zur Planung deines ersten Surftrips haben wir alles, was du brauchst, um dich vom Surfanfänger zum begeisterten Wellenreiter zu entwickeln.","Published","Published"
"https://www.rapturecamps.com/blog/best-places-to-eat-near-green-bowl/",,"Places to eat near Green Bowl Surfcamp in Bali · Rapture","Explore the best area's around Green Bowl, Bali to grab a cocktail and some fresh Balinese cuisine to end your action packed day of surfing.",,,"Published","Missing"
"https://www.rapturecamps.com/blog/longboard-vs-shortboard/",,"Longboard Vs Shortboard: What's The Difference? · Rapture","Longboards stretch between eight and ten feet, while shortboards typically run from 5'6"" to 6'8"". These measurements aren't random however.",,,"Published","Missing"
"https://www.rapturecamps.com/blog/manuel-antonio-national-park/",,"Manuel Antonio National Park: A Guide To Costa · Rapture","Manuel Antonio National Park combines pristine beaches, lush rainforest and abundant wildlife in one compact, accessible location.",,,"Published","Missing"
"https://www.rapturecamps.com/blog/mastering-duck-diving-techniques-for-surfers/",,"Mastering Duck Diving: Techniques For Surfers",,,,"Draft","Missing"
"https://www.rapturecamps.com/blog/the-art-of-longboard-surf/",,"Mastering The Art Of Longboard Surf: Tips For · Rapture","From selecting the perfect longboard to mastering the nuances of paddling and wave-catching, learn how to master the art of longboard surf.",,,"Published","Missing"
"https://www.rapturecamps.com/blog/off-peak-surf-lessons-in-bali/",,"Off-Peak Surf Lessons in Bali’s Tropical Waters · Rapture","From saving on costs to scoring quality one-on-one instruction, an off-peak surf camp delivers the ultimate low-key learning experience.",,,"Published","Missing"
"https://www.rapturecamps.com/blog/medewi-surf-guide/",,"Medewi Surf Guide: Bali’s Longest Left-Hand Wave · Rapture","Medewi remains one of the island's best-kept surfing secrets. It offers a perfect left-hand wave that peels for up to 400 meters.",,,"Published","Missing"
"https://www.rapturecamps.com/blog/mentawai-islands-the-perfect-tropical-getaway-for-adventure-seekers/",,"Mentawai Islands: The Perfect Tropical Getaway for Adventure Seekers",,,,"Draft","Missing"
"https://www.rapturecamps.com/blog/mount-batur-bali/",,"Mount Batur Trekking: A Surfer’s High Beyond The · Rapture","Climbing Mount Batur offers an unforgettable experience that perfectly complements your love for the outdoors.",,,"Published","Missing"
"https://www.rapturecamps.com/blog/nazare-waves/",,"Nazaré: Home To The World’s Biggest Waves · Rapture","Nazaré is known for it's massive swells that roll in from the ocean. Waves up to 100ft high crash against the headland at Praia do Norte, but how?",,,"Published","Missing"
"https://www.rapturecamps.com/blog/nicaragua-travel-guide-what-you-need-to-know/",,"Visit Nicaragua: The Only Travel Guide You'll · Rapture","Explore the beauty of Nicaragua with our ultimate travel guide. Discover the top destinations, activities, and insider tips.",,,"Published","Missing"
"https://www.rapturecamps.com/blog/nicaragua-vs-costa-rica/",,"Nicaragua vs Costa Rica: Weather, Cost, Best · Rapture","Both countries offer stunning waves, vibrant cultures, and endless opportunities for exploration but which one is best? Find out more!",,,"Published","Missing"
"https://www.rapturecamps.com/blog/nightlife-in-ericeira/","https://www.rapturecamps.com/de/blog/ericeiras-nachtleben-und-andere-aktivitaten/","Nightlife in Ericeira: Where to hangout & party · Rapture","Besides surfing the best waves Portugal has to offer, there are plenty other things to do in Ericeira, such as sightseeing, music, food, nightlife & nature!","Ericeira Nachtleben und Aktivitäten · Rapture","Nebst dem Surfen gibt es in Ericeira noch viele andere Dinge zu tun, wie zum Beispiel Sightseeing, Musik, Essen, Nachtleben und Natur! Erfahre hier mehr!","Published","Published"
"https://www.rapturecamps.com/blog/one-week-in-costa-rica-travel-itinerary/",,"One Week In Costa Rica: The Perfect Travel · Rapture","From misty cloud forests, pristine beaches and volcanic landscapes, we've got you covered with our week long Costa Rica itinerary!",,,"Published","Missing"
"https://www.rapturecamps.com/blog/origins-of-surfing-from-ancient-rituals-to-modern-surfing-history/",,"Origin of Surfing: Answers to Where, When, and · Rapture","Discover the fascinating history of surfing, about its origins, from where & when it started to how it became the beloved sport it is today.",,,"Published","Missing"
"https://www.rapturecamps.com/blog/packing-essentials-bali-surfing/",,"5 Packing Essentials for Bali Surf Trip · Rapture","Planning a surf trip to Bali? Don't forget to pack these must-have items to make the most of your time catching waves in paradise.",,,"Published","Missing"
"https://www.rapturecamps.com/blog/surf-holidays-portugal/","https://www.rapturecamps.com/de/blog/surfurlaub-portugal/","Planning a Surf Holiday in Portugal? Here’s All · Rapture","Planning a surf adventure in Portugal? Discover the top surf spots, find the best surf schools, and tips on where to stay and eat.","Surfurlaub in Portugal · Rapture","Wenn unglaubliche Wellen, sonnige Tage, tolles Essen, vorzüglicher Wein und erschwingliche Preise das sind, wonach Sie suchen, dann erfüllt ein Surfurlaub in Portugal all diese Kriterien!","Published","Published"
"https://www.rapturecamps.com/blog/planning-a-surf-trip-to-the-tropics-10-essentials-you-shouldnt-forget/","https://www.rapturecamps.com/de/blog/du-planst-einen-surftrip-in-die-tropen-10-dinge-die-du-einpacken-musst/","Planning a Tropical Surf Trip? Don't Forget these · Rapture","Going on a tropical surf trip? This list of 10 essentials will ensure you have everything you need for a successful and enjoyable adventure.","Packliste für deinen Surfurlaub in den Tropen · Rapture","Ein Surftrip in die Tropen? Diese 10 wichtigen Dinge musst du unbedingt einpacken! So hast du garantiert die beste Zeit.","Published","Published"
"https://www.rapturecamps.com/blog/portugal-in-october/",,"Portugal In October: Top Surf Spots You Can't Miss · Rapture","Is October a good time to surf in Portugal? With warm weather, fewer tourists, and great waves, October is perfect for a surf trip.",,,"Published","Missing"
"https://www.rapturecamps.com/blog/portugal-makes-waves-liga-meo-pro-surf-and-another-big-wave-record/","https://www.rapturecamps.com/de/blog/portugal-schlaegt-wellen-meo-pro-surf-liga-und-ein-weiterer-big-wave-rekord/","Another Big Wave World Record: Garrett McNamara · Rapture","Surf Portugal: a global surfing stage: Record-breaking surfer McNamara and his 27.4m wave in Nazare and the new MEO Pro Surf League.","MEO Pro Surf Liga und ein Big Wave Rekord? · Rapture","Surfen in Portugal: eine globale Surfbühne: Rekord-Surfer McNamara und seine 27,4m Welle in Nazare und die neue MEO Pro Surf Liga.","Published","Published"
"https://www.rapturecamps.com/blog/portugal-travel-guide-all-you-need-to-know-before-you-plan-a-trip/",,"Portugal Travel Guide: Flights, How to Get Around · Rapture","Visiting Portugal? All the information including tips on flights, transportation, and more here! Start planning your dream trip now!",,,"Published","Missing"
"https://www.rapturecamps.com/blog/awayco-light-gearless-travelling/","https://www.rapturecamps.com/de/blog/awayco-leichtes-reisen-ohne-surfboard/","Rent the Best Surfboards in Bali & avoid fees · Rapture","In our surf camp in Padang-Padang (Bali) we're welcoming Awayco rental. Surf and travel gearless avoiding baggage fees and cramped rental cars!","Awayco - Leichtes Reisen ohne Surfboard · Rapture","Einfaches und unkompliziertes Reisen bei Rapture. Deshalb begrüßen wir Awayco an unserem Standort in Padang-Padang (Bali). Surfen und Reisen ohne Ausrüstung","Published","Published"
"https://www.rapturecamps.com/blog/pura-vida-in-costa-rica-what-does-it-actually-mean/",,"What does Pura Vida mean in Costa Rica? · Rapture","Book a few days at our surf camp near Tamarindo and discover the beauty of Pura Vida for yourself in stunning Costa Rica.",,,"Published","Missing"
"https://www.rapturecamps.com/blog/surf-bali-rainy-season/","https://www.rapturecamps.com/de/blog/warum-bali-in-der-regenzeit-besuchen-und-surfen/","Can you Surf during Bali's Rainy Season? Yes! · Rapture","Discover the 5 secrets why surfers prefer Bali in the rainy season! Don't let the rain stop you from experiencing the thrill of surfing Bali.","Topziel I Bali in der Regenzeit · Rapture","Du bist kein Fan von Menschenmassen, willst aber unbedingt Bali besuchen? Dann komm während der Regenzeit und surfe menschenleere Wellen an der Ostküste.","Published","Published"
"https://www.rapturecamps.com/blog/raptures-surf-camp-nicaragua-hosting-isa-surf-coaching-courses/","https://www.rapturecamps.com/de/blog/rapture-surfcamp-nicaragua-veranstaltet-isa-kurse/","Join the ISA surf coaching in Nicaragua · Rapture","Dream of becoming a certified surf instructor? Contact Era Adventures today and enjoy 15% off your stay at our surf camp in Nicaragua.","Rapturecamps Nicaragua veranstaltet ISA Kurse · Rapture","Du träumst davon ein lizensierter Surflehrer zu sein? Kontaktiere Era Adventures noch heute und buche deinen ISA Kurs in Nicaragua.","Published","Published"
"https://www.rapturecamps.com/blog/how-to-surf-eco-friendly/","https://www.rapturecamps.com/de/blog/umweltfreundlich-surfen-how-to/","6 Tips for Sustainable Surfing: Eco-friendly Surf · Rapture","As the sport of surfing grows, so does its environmental impact. Here are a 6 ways you can enjoy eco-friendly surfing.","Umweltfreundliche Surf-Alternativen · Rapture","Mit der Zunahme des Surfsports wächst auch dessen Umweltbelastung. Unser Blog berichtet über einige umweltfreundliche Alternativprodukte für das Surfen (und Sonnenbaden).","Published","Published"
