EN URL,DE URL,EN Meta Title,EN Meta Description,DE Meta Title,DE Meta Description,EN Status,DE Status
"https://www.rapturecamps.com/blog/rio-celeste/",,"Rio Celeste: The Magical Blue River In Costa Rica · Rapture","Rio Celeste attracts visitors from around the world with its otherworldly turquoise waters that seem almost too vibrant to be natural.",,,"Published","Missing"
"https://www.rapturecamps.com/blog/beach-signs-and-flags/","https://www.rapturecamps.com/de/blog/sicherheit-geht-vor-der-leitfaden-fuer-surfer-zum-umgang-mit-strandschildern-und-flaggen/","Safety First: A Surfer’s Guide to Navigating Beach · Rapture","Beach flags - what do the colours mean? Discover all the beach signs and flags so you can stay safe on your next surfing adventure.","Sicherheit geht vor: Der Leitfaden für Surfer zum Umgang mit Strandschildern und Flaggen · Rapture","Strandflaggen - was bedeuten die Farben? Entdecke alle Strandschilder und Flaggen, damit du bei deinem nächsten Surfabenteuer sicher bist.","Published","Published"
"https://www.rapturecamps.com/blog/best-eats-in-tamarindo/",,"Savoring Tamarindo: A Surfers Guide To The Best · Rapture","We've got you covered with some top Costa Rica food. Let's dive into Tamarindo's culinary offerings. The surf's up, and dinner is served.",,,"Published","Missing"
"https://www.rapturecamps.com/blog/visit-sawu-island/",,"Visit Sawu Islands: How To Get There? – Things To · Rapture","Looking for a unique getaway? Sawu Island in Indonesia is the perfect offbeat destination with pristine beaches and local cuisine.",,,"Published","Missing"
"https://www.rapturecamps.com/blog/a-guide-to-wetsuit-rash/",,"Say Goodbye To Wetsuit Rash With These Proven · Rapture","In this blog post, we'll dive deep into everything you need to know about wetsuit rash, from its causes to the best prevention techniques.",,,"Published","Missing"
"https://www.rapturecamps.com/blog/surf-workout-plans/",,"Shred The Waves: Surf Workout Plans For All Levels · Rapture","Find out how our surf workout guide is meticulously crafted to amp up your strength, endurance, and mental resilience on the waves.",,,"Published","Missing"
"https://www.rapturecamps.com/blog/best-hangouts-in-tamarindo/",,"Sip, Surf, and Socialise: Best Hangouts in · Rapture","In this guide, uncover the best spots to relax, refuel, and mingle after long days of riding Costa Rica's famous breaks.",,,"Published","Missing"
"https://www.rapturecamps.com/blog/solo-trip-to-portugal/",,"Solo Trip to Portugal: Surf, Explore, and Relax · Rapture","A solo surf trip to Portugal offers the perfect blend of adventure, self-discovery, and relaxation. Learn more!",,,"Published","Missing"
"https://www.rapturecamps.com/blog/solo-trip-to-portugal-surf-explore-and-relax-with-rapturecamps/",,"Solo Trip to Portugal_ Surf, Explore, and Relax with Rapturecamps",,,,"Draft","Missing"
"https://www.rapturecamps.com/blog/tour-of-green-bowl-surf-camp/",,"A Tour of Green Bowl Surf Camp · Rapture","Welcome to our Green Bowl Surfcamp, where each detail is crafted for surfers and travellers seeking comfort alongside their ocean adventure.",,,"Published","Missing"
"https://www.rapturecamps.com/blog/the-best-wetsuit-for-surfing/","https://www.rapturecamps.com/de/blog/anzug-anziehen-die-wahl-des-richtigen-neoprenanzugs-fuer-dein-surfing-abenteuer/","Suit Up: Choosing the Right Wetsuit for Your · Rapture","Struggling to decide which wetsuit is best for your next surfing adventure? Let us explain everything you need to know.","Anzug anziehen: Die Wahl des richtigen Neoprenanzugs für dein Surf-Abenteuer · Rapture","Du kannst dich nicht entscheiden, welcher Neoprenanzug der beste für dein nächstes Surfabenteuer ist? Wir erklären dir alles, was du wissen musst.","Published","Published"
"https://www.rapturecamps.com/blog/sumatra-surf-spots/",,"Sumatra Surf Spots: A Guide To The Best Waves · Rapture","While Bali and Lombok steal much of the surfing spotlight, Sumatra's coastline hides some of Southeast Asia's most thrilling waves.",,,"Published","Missing"
"https://www.rapturecamps.com/blog/year-round-surfing-costa-rica/","https://www.rapturecamps.com/de/blog/ganzjahrige-surf-saison-costa-rica/","Costa Rica's Year-Round Surfing Seasons · Rapture","As we've already hinted, Costa Rica offers rideable waves all year, making it a surfer’s dream destination, but what about the weather?","Costa Ricas ganzjährige Surfsaisons %%sepe% · Rapture","Wie wir bereits angedeutet haben, bietet Costa Rica das ganze Jahr über surfbare Wellen, was es zu einem Traumziel für Surfer macht. Aber wie sieht es mit dem Wetter aus?","Published","Published"
"https://www.rapturecamps.com/blog/surf-crowd-free-in-vila-nova-de-milfontes/",,"Crowd-free Surfing in Vila Nova de Milfontes · Rapture","Find the best breaks and learn under top-notch instructors at Rapture Surfcamps in Vila Nova de Fontes. Safety and Fun Assured!",,,"Published","Missing"
"https://www.rapturecamps.com/blog/surf-legends-inspirational-stories/",,"Surf Legends: Inspirational Stories from the Big · Rapture","Read the inspirational stories of these ecstatic watermen and women and their triumphs worth retelling again and again.",,,"Published","Missing"
"https://www.rapturecamps.com/blog/tips-to-choose-surf-lessons-in-bali/",,"Best Surf Lessons in Bali: Tips To Choose The · Rapture","Looking for surf lessons in Bali? Find the best one for you with our comprehensive guide to surf schools and instructors in Bali.",,,"Published","Missing"
"https://www.rapturecamps.com/blog/surf-lessons-in-nicaragua-heres-what-you-need-to-know/","https://www.rapturecamps.com/de/blog/surf-lessons-in-nicaragua-alles-was-du-wissen-musst/","Surfing in Nicaragua: Surf Camps, Top Surf Spots · Rapture","The sun is shining and the waves are firing... those surf lessons in Nicaragua are calling your name. Book a stay today or read this article for more info.","Surf Lessons in Nicaragua - Alle Infos! · Rapture","Bei uns im Surfcamp kannst du deine Träume über Surf Lessons in Nicaragua wirklich werden lassen - alle wichtigen Infos findest du hier!","Published","Published"
"https://www.rapturecamps.com/blog/surf-lessons-in-ericeira-portugal/","https://www.rapturecamps.com/de/blog/surfen-lernen-in-ericeira-portugal/","Surf Lessons in Portugal: All levels – Ericeira · Rapture","Our surf lessons cater to all levels, from beginners to advanced. Join us in Ericeira or Milfontes to learn under certified instructors.","Surfkurse in Ericeira - Top Reiseziel Portugal · Rapture","Surfen lernen in Portugal? Unsere Lehrer sind erfahren, sachkundig und verfügen über hochwertige europäische Lizenzen (ISA).","Published","Published"
"https://www.rapturecamps.com/blog/surfer-lingo-and-surfing-terms/",,"12 Surfer Lingo For Beginners: Glossary of Surf · Rapture","Surf's up, dude! Get ready to shred some gnar with this comprehensive glossary of surfer lingo that has got your covered!",,,"Published","Missing"
"https://www.rapturecamps.com/blog/surf-skate-what-you-need-to-know/",,"What is surf skating? Is it for you? Find out · Rapture","As the name indicates, surf skateboarding is a sport designed to mimic surfing on a surf skateboard - find your guide to surf skateboarding!",,,"Published","Missing"
"https://www.rapturecamps.com/blog/surf-uncrowded-waves-in-vila-nova-de-milfontes/",,"Beat the Crowds at Vila Nova de Milfontes: Surf · Rapture","Look no further, surf lessons at Milfontes in Portugal, where Rapture Surf Camp awaits to provide an unforgettable adventure.",,,"Published","Missing"
"https://www.rapturecamps.com/blog/rainy-season-surf-nicaragua/","https://www.rapturecamps.com/de/blog/surfen-in-nicaragua-in-der-regenzeit/","Surf in Nicaragua in the Rainy Season · Rapture","Nicaragua is a beautiful country which can be visited all year round. Come check it out in rainy season and surf with us at Rapture Surfcamps.","Regenzeit Surfen in Nicaragua · Rapture","Kann man in der Regenzeit in Nicaragua gut Surfen? Und wenn ja, welche Surf-Spots gibt es? Das und noch mehr liest du hier!","Published","Published"
"https://www.rapturecamps.com/blog/surfboard-anatomy-101-breaking-down-the-different-components/",,"What Are The Different Parts of a Surfboard? · Rapture","Explore the different components of a surfboard and gain a deeper understanding of how each part contributes to your surfing experience.",,,"Published","Missing"
"https://www.rapturecamps.com/blog/surfer-diet/",,"Surfer Diet: What To Eat When You’re Surfing · Rapture","So what exactly do surfers eat? We’ve been chatting with wave-riders and nutrition-savvy pros to get the lowdown on the best surfer diet.",,,"Published","Missing"
"https://www.rapturecamps.com/blog/a-guide-to-surfer-hair/","https://www.rapturecamps.com/de/blog/ein-leitfaden-zum-surfer-haar/","Surfer Hair: A Complete Guide To Care And Styling · Rapture","This guide shows you how to achieve and maintain that effortless surfer hair look, no matter where you are.","Surfer-Haar: Ein vollständiger Leitfaden zur Pflege und zum Styling · Rapture","Dieser Leitfaden zeigt Ihnen, wie Sie den mühelosen Surfer-Look für Ihr Haar erreichen und beibehalten können, egal wo Sie sich befinden.","Published","Published"
"https://www.rapturecamps.com/blog/legian-beach-bali/",,"Surfing And Relaxing At Legian Beach, Bali · Rapture","Legian Beach sits in that sweet spot between Kuta's endless party and Seminyak's upscale scene, offering a perfect blend of surf and serenity.",,,"Published","Missing"
"https://www.rapturecamps.com/blog/surfing-at-night/",,"Surfing At Night: Tips, Gear, And Safety · Rapture","We cover the essential gear, safety tips, and how to find the best moonlit waves for an unforgettable night surfing session!",,,"Published","Missing"
"https://www.rapturecamps.com/blog/surf-ericeira/","https://www.rapturecamps.com/de/blog/surfen-ericeira/","Surf Ericeira: Best of Portugal's Surf Breaks · Rapture","The only list of surf breaks in Ericeira you need and all details of beaches, natural gems and the perfect waves, for kinds of surfers.","Ericeira - Europas Surf Hotspot · Rapture","Wolltest du schon immer nach Ericeira zum Surfen? Entdecke unberührte Strände, atemberaubende Natur und die perfekten Wellen.","Published","Published"
"https://www.rapturecamps.com/blog/surfing-for-beginners/","https://www.rapturecamps.com/de/blog/surfen-fuer-anfaenger/","Surfing For Beginners: How To Ride The Waves With · Rapture","Discover our guide on surfing for beginners: tips on choosing the right board, mastering the pop-up, and more.","Surfen für Anfänger: Wie du die Wellen mit Selbstvertrauen reitest · Rapture","Entdecke unseren Leitfaden zum Surfen für Anfänger: Tipps zur Wahl des richtigen Boards, zum Meistern des Pop-up und mehr.","Published","Published"
"https://www.rapturecamps.com/blog/surfing-in-lombok/",,"Surfing in Lombok: Best Time To Surf – Top 3 · Rapture","Lombok is a hidden gem for surfers, offering some of the best waves in Indonesia. Discover the best time to surf and the top surf spots here!",,,"Published","Missing"
"https://www.rapturecamps.com/blog/surfing-in-madeira/","https://www.rapturecamps.com/de/blog/surfen-auf-madeira-versteckte-spots-fuer-surfer/","Surfing In Madeira: Hidden Spots For Surfers · Rapture","Perched in the Atlantic some 600 miles from mainland Portugal, Madeira might surprise anyone looking for a place to surf.","Surfen auf Madeira: Versteckte Spots · Rapture","Madeira, im Atlantik gelegen, etwa 600 Meilen vom portugiesischen Festland entfernt, ist ein unerwartetes Paradies für Surfer.","Published","Published"
"https://www.rapturecamps.com/blog/surfing-in-the-azores/",,"Surfing In The Azores: A Guide To Portugal’s · Rapture","Surfing in the Azores is ideal as the Atlantic islands deliver waves all year round, the biggest swells from October through March.",,,"Published","Missing"
"https://www.rapturecamps.com/blog/surfing-lessons-101/",,"Surfing Lessons 101 · Rapture","We’ll show you how to pick the right surf school, what to expect in your first surf lesson and list all the essential gear you’ll need.",,,"Published","Missing"
"https://www.rapturecamps.com/blog/surf-lessons-in-portugal-the-best-country-in-europe-to-learn-the-art-of-surfing/",,"Surf Lessons in Portugal - Beginner to Pro · Rapture","You've never surfed before in your life but you can't wait to try? Join our professional and fun surf lessons in Ericeira, Portugal",,,"Published","Missing"
"https://www.rapturecamps.com/blog/mistakes-you-make-as-a-surfer-and-tips-on-how-to-fix-them/",,"Surfing Mistakes (And Tips To Fix Them) · Rapture","Surfing is an exhilarating and rewarding sport that allows you to connect with the ocean and ride the waves. However, as a beginner surfer, it's common to face a few challenges and make some surfing mistakes during the learning process.",,,"Published","Missing"
"https://www.rapturecamps.com/blog/surfing-safely-in-bali-surf-camps/",,"Surfing Safely in Bali: Safety Standards at · Rapture","Enjoy the thrill of surfing in Bali with peace of mind, knowing that Rapture Surfcamps upholds the highest safety standards for all surfers.",,,"Published","Missing"
"https://www.rapturecamps.com/blog/surfing-safety-tips-in-costa-rica/",,"Surfing Safety: Tips for Staying Safe on Costa · Rapture","We discuss our favourite Costa Rica beaches as well as essential surfing safety tips for each. Let's dive straight into it!",,,"Published","Missing"
"https://www.rapturecamps.com/blog/surfing-uluwatu/","https://www.rapturecamps.com/de/blog/surfen-uluwatu/","Surfing Uluwatu: 5 Reef Breaks for Experienced · Rapture","Uluwatu in Bali is a surfer's paradise. Discover the top 5 reef breaks in Uluwatu,Bali and experience the thrill of riding these epic waves!","Surfen in Uluwatu - Hier werden Träume wahr · Rapture","Uluwatu ist immer noch eines der legendärsten Surf-Erlebnisse Balis. Hier erfährst du alles, was du über die 5 Surfbreaks von Uluwatu wissen musst.","Published","Published"
"https://www.rapturecamps.com/blog/surfing-at-the-2024-paris-olympics/",,"Surfing at the 2024 Paris Olympics · Rapture","For the second time ever, surfing once again has it's well deserved feature at the 2024 Paris Olympics. Find out more!",,,"Published","Missing"
"https://www.rapturecamps.com/blog/surfing-in-green-bowl-heres-all-you-need-to-know/",,"Surfing Green Bowl: Bali Surfing Guide (All Tips · Rapture","Our Bali surfing guide has all the insider tips and information you need to have an unforgettable surfing experience at Green Bowl.",,,"Published","Missing"
"https://www.rapturecamps.com/blog/surfing-in-padang-padang/",,"Surfing in Padang Padang",,,,"Draft","Missing"
"https://www.rapturecamps.com/blog/surfing-padang-padang/","https://www.rapturecamps.com/de/blog/surfen-padang-padang/","Surfing Padang Padang: Balinese Surf Paradise · Rapture","Experience the thrill of riding the waves at Padang Padang. Discover the perfect barrels and stunning coastal scenery.","Traumlocation Padang Padang · Rapture","Ihr habt schon immer vom Surfen in Padang Padang geträumt? Finde heraus warum es sich hierbei um eine von Balis beliebtesten Wellen handelt.","Published","Published"
"https://www.rapturecamps.com/blog/surfing-in-portugal-a-brief-history/","https://www.rapturecamps.com/de/blog/surfen-in-portugal-ein-kurzer-uberlick-uber-die-geschichte-dahinter/","History of Surfing in Portugal: Evolution of the · Rapture","Explore the vibrant history of surfing in Portugal. Discover its legendary waves, surf icons, and top surf spots shaping global surf culture.","Die Geschichte des Surfens in Portugal · Rapture","Genieße eine Surfstunde in Portugal mit unserem neuesten Artikel, der die Geschichte des Surfens in diesem wunderschönen Surfziel aufzeichnet.","Published","Published"
"https://www.rapturecamps.com/blog/surfing-in-sumbawa/",,"Surfing in Sumbawa: Indonesia Surf Scene · Rapture",". Discover the hidden gem of Sumbawa to know why this Indonesian island is a surfer's paradise and plan your next adventure now!",,,"Published","Missing"
"https://www.rapturecamps.com/blog/surfing-into-the-holidays-have-a-merry-christmas-on-the-waves/",,"3 Christmas Surfing Destination: December Surfing · Rapture","Grab your surfboard and head to these incredible surfing destinations in December. Get ready for an unforgettable holiday experience!",,,"Published","Missing"
"https://www.rapturecamps.com/blog/surfing-with-an-apple-watch/",,"Surfing with an Apple Watch: Set up, Apps · Rapture","We've been using Apple Watches for surfing since the release of the Apple Watch 2 in 2016, here's everything we've learnt. Tips and tricks!",,,"Published","Missing"
"https://www.rapturecamps.com/blog/bali-winter-escape/",,"Swap Snow For Surf: Why Bali Is The Perfect Winter · Rapture","Dreading the frosty months? How about a Bali winter getaway? Learn how you could be surfing and sunbathing in December!",,,"Published","Missing"
"https://www.rapturecamps.com/blog/swimsuits-for-surfing/",,"Swimsuits For Surfing · Rapture","When it comes to surf swimwear, snug is the name of the game. It should hug the body without restricting movement.",,,"Published","Missing"
"https://www.rapturecamps.com/blog/the-13-best-beaches-in-bali/",,"The 13 Best Beaches in Bali · Rapture","From lively, sun-kissed shores to secluded, tranquil hideaways, explore the best beaches Bali has to offer!",,,"Published","Missing"
"https://www.rapturecamps.com/blog/the-7-best-surf-camps-in-the-world/",,"7 Best Surf Camps in the World: Find the Right · Rapture","Find your perfect surf spot at one of these incredible surf camps for all levels of surfing enthusiasts and preferences.",,,"Published","Missing"
"https://www.rapturecamps.com/blog/best-beginner-surf-spots-in-bali/","https://www.rapturecamps.com/de/blog/besten-surfspots-fur-anfanger-auf-bali/","7 Spots for Surfing in Bali for Beginners: Bali · Rapture","Discover the top 7 beginner-friendly surf spots in Bali! Dive into the world of surfing with ease at these stunning locations.","Die besten Surfspots für Anfänger in Bali · Rapture","Wo gibt es in Bali die besten Spots für Anfänger? Erfahre mehr über die 5 beliebtesten Beachbreaks auf Bali und starte dein Surf Abenteuer.","Published","Published"
"https://www.rapturecamps.com/blog/the-best-beaches-in-bali/",,"The Best Beaches In Bali",,,,"Draft","Missing"
"https://www.rapturecamps.com/blog/the-best-soft-top-surfboards/",,"The Best Soft Top Surfboards For Beginners And · Rapture","For new surfers, a soft top surfboard offers the perfect blend of stability, safety, and fun. Learn which foam board is best for you.",,,"Published","Missing"
"https://www.rapturecamps.com/blog/the-best-surf-clothing-brands-in-2025/",,"The Best Surf Clothing Brands in 2025 · Rapture","Explore the top surf clothing brands of 2024. Find stylish, durable gear from the best in the industry to enhance your surfing experience.",,,"Published","Missing"
"https://www.rapturecamps.com/blog/types-of-surfing/",,"The Different Types of Surfing · Rapture","From surfing styles, surf breaks and the essential surfboard basics, explore everything there is to know about the extreme sport.",,,"Published","Missing"
"https://www.rapturecamps.com/blog/the-evolution-of-surfboard-designs/",,"The Evolution Of Surfboard Designs · Rapture","Surfboard designs have come a long way from the solid wooden boards of ancient Polynesians to today’s sleek and specialised models.",,,"Published","Missing"
"https://www.rapturecamps.com/blog/the-meaning-and-history-of-shaka/",,"The Meaning And History Of Shaka · Rapture","The shaka's origins lie in Hawaii. Locals used it to say hello, goodbye, thanks, or just to spread good vibes.",,,"Published","Missing"
"https://www.rapturecamps.com/blog/the-most-beautiful-beaches-in-costa-rica/",,"The Most Beautiful Beaches In Costa Rica · Rapture","Whether you're an avid surfer or simply looking to soak up the sun, we explore the most beautiful beaches in Costa Rica.",,,"Published","Missing"
"https://www.rapturecamps.com/blog/square-waves/",,"The Power of Square Waves: Everything Surfers Need · Rapture","In this article, we dive deep into the world of square waves, unravelling the science behind their formation and the risks they pose.",,,"Published","Missing"
"https://www.rapturecamps.com/blog/the-ultimate-bali-travel-guide/",,"The Ultimate Bali Travel Guide: Plan Your 2024 · Rapture","Get ready for your dream vacation in Bali. Our comprehensive travel guide covers everything you need to know to make the most of your trip.",,,"Published","Missing"
"https://www.rapturecamps.com/blog/the-ultimate-couples-getaway-our-surf-camp-in-portugal/",,"The Ultimate Couple Getaway: Surf Trips for · Rapture","Discover romance, adventure, and the thrill of the waves in a picturesque setting. Embark on the perfect couples getaway here!",,,"Published","Missing"
"https://www.rapturecamps.com/blog/the-ultimate-guide-to-nusa-lembongan/",,"The Ultimate Guide To Nusa Lembongan · Rapture","From hidden beaches, epic surfing spots, or simply a hammock with a view, Nusa Lembongan delivers the dream island experience.",,,"Published","Missing"
"https://www.rapturecamps.com/blog/the-ultimate-guide-to-surfing-portugal/","https://www.rapturecamps.com/de/blog/der-ultimative-leitfaden-zum-surfen-in-portugal-rapture-surfcamps/","The Ultimate Portugal Surf Guide for (Best Season · Rapture","Planning a surf trip to Portugal in 2023? This guide will cover insider tips on the best spots and time to experience the ultimate surf trip.","Der ultimative Leitfaden I Surfen in Portugal · Rapture","Die besten Surfspots, von Ericeira und Lissabon nach Peniche, zur Algarve, zu den Inseln und noch vieles mehr zum Surfen in Portugal.","Published","Published"
"https://www.rapturecamps.com/blog/the-best-places-to-live-for-surfers/",,"The Ultimate Guide to the Best Places to Live for · Rapture","When looking for the best places to live as a surfer, its important to consider - cost of living, wave consistency, climate, local culture...",,,"Published","Missing"
"https://www.rapturecamps.com/blog/sunscreen-for-surfers/",,"Sunscreen For Surfers Guide: Chemical Vs · Rapture","Dive into our 2024 guide that compares chemical vs mineral sunscreens and lists surfers' top choices to help you make an informed choice.",,,"Published","Missing"
"https://www.rapturecamps.com/blog/surf-etiquette-for-surfers/",,"Surf Etiquette 101: 8 Easy Rules For All Levels · Rapture","Whether you're a beginner or an experienced, you can't ignore surfing etiquette ! Ensure a harmonious surfing experience with these 8 rules.",,,"Published","Missing"
"https://www.rapturecamps.com/blog/things-to-know-before-travelling-to-nicaragua/",,"Things to Know Before Travelling to Nicaragua",,,,"Draft","Missing"
"https://www.rapturecamps.com/blog/things-to-do-in-nicaragua/",,"Things to do in Nicaragua",,,,"Draft","Missing"
"https://www.rapturecamps.com/blog/tidal-bore-surfing-explained/",,"Ultimate Guide to Tidal Bore Surfing: How to Ride · Rapture","Discover the thrill of tidal bore surfing. Learn how to ride these unique river waves, explore the best locations, and get tips for beginners.",,,"Published","Missing"
"https://www.rapturecamps.com/blog/booking-the-best-surf-camp-in-bali/",,"Book The Best Surfcamp In Bali: Tips, Factors To · Rapture","Ready to catch some waves? Discover the key factors to check when booking a surf camp in Bali and make the most of your tropical adventure.",,,"Published","Missing"
"https://www.rapturecamps.com/blog/how-to-pull-off-a-surf-trip-in-portugal-this-summer/","https://www.rapturecamps.com/de/blog/was-du-diesen-sommer-in-portugal-nicht-verpassen-darfst/","Tips to Pull off the Most Epic Surf Trip to · Rapture","Make the most of your time off this summer by embarking on an epic surf trip through Portugal. Get tips on transport, food and more!","Tips für deinen Sommer in Portugal · Rapture","Mach das Beste aus deinen Ferien und plane einen Sommer in Portugal. Wir haben einige Tips und Tricks für dich zusammengeschrieben.","Published","Published"
"https://www.rapturecamps.com/blog/top-10-most-dangerous-surf-spots-in-the-world/",,"Top 10 Most Dangerous Surf Spots In The World · Rapture","From Portugal's monster swells at Nazaré to Teahupoo's fierce barrels in Tahiti we cover the 10 most dangerous surf spots in the world.",,,"Published","Missing"
"https://www.rapturecamps.com/blog/top-10-surf-documentaries-of-all-time/",,"Top 10 Surf Documentaries Of All Time · Rapture","From ""The Endless Summer"" to “Girls Can’t Surf,” check out our favourite surfing documentaries of all time!",,,"Published","Missing"
"https://www.rapturecamps.com/blog/top-10-things-to-do-in-ubud-bali/",,"Top 10 Things To Do In Ubud, Bali · Rapture","Whether you’re an adventure seeker, a culture enthusiast, or simply looking for a serene escape, here are our top things to do in Ubud, Bali.",,,"Published","Missing"
"https://www.rapturecamps.com/blog/what-to-see-in-tamarindo-costa-rica/","https://www.rapturecamps.com/de/blog/die-10-top-aktivitaten-in-tamarindo-costa-rica/","10 Best Things to Do in Tamarindo Costa Rica · Rapture","Tamarindo, Costa Rica is a bustling tourist town that lures surfers and vacationers alike. Enjoy Tamarindo to the fullest with this list!","Die 10 Top Aktivitäten in Tamarindo · Rapture","Tamarindo ist eine lebhafte Touristenstadt, die sowohl Surfer als auch Urlauber anlockt. Hier sind die 10 Top Aktivitäten in Tamarindo.","Published","Published"
"https://www.rapturecamps.com/blog/places-to-eat-and-drink-in-ericeira/",,"Top 13 Restaurants in Ericeira Guide · Rapture","Looking for the BEST food and drink on your surf holiday in Ericeira? Check out our recommendations to enjoy the best of Portuguese cuisine!",,,"Published","Missing"
