EN URL,DE URL,EN Meta Title,EN Meta Description,DE Meta Title,DE Meta Description,EN Status,DE Status
"https://www.rapturecamps.com/blog/surf-camp-and-surf-lessons-in-costa-rica-everything-you-need-to-know/","https://www.rapturecamps.com/de/blog/alles-was-du-uber-unser-camp-in-costa-rica-wissen-musst/","Surf Lessons in Costa Rica: Playa Avellanas and · Rapture","Our go-to guide for surfers who crave a trip to the tropics that ticks all of the right boxes. Here's all you need to know before booking.","Surfcamp und Surf Lessons in Costa Rica · Rapture","Du sehnst dich nach Urlaub in den Tropen und nach den besten Wellen? Komm zu uns ins Surfcamp nach Costa Rica und buche Surf Lessons.","Published","Published"
"https://www.rapturecamps.com/blog/all-you-need-to-know-about-surfing-in-g-land/",,"Surfing G-Land: Top Surf Spot in Indonesia · Rapture","Discover the thrill of surfing at G-Land, a popular surf spot in Indonesia! Get ready to catch some epic waves for the ultimate surf adventure.",,,"Published","Missing"
"https://www.rapturecamps.com/blog/surfing-at-nias/",,"Surf Nias: Top Surf Spots, Travel Tips & · Rapture","Discover Nias, Indonesia's surf paradise. Explore Lagundri Bay and more with essential travel tips and must-know surf advice.",,,"Published","Missing"
"https://www.rapturecamps.com/blog/an-ultimate-guide-to-surfing-sayulita/",,"An Ultimate Guide to Surfing Sayulita",,,,"Draft","Missing"
"https://www.rapturecamps.com/blog/surf-apartments-ericeira-portugal/","https://www.rapturecamps.com/de/blog/surf-apartment-portugal/","Beachfront Surf Apartments in Ericeira · Rapture","Book a private apartment on the beach with ocean views for while still enjoying the surf camp experience and vibes.","Surf-Ferienwohnung in Ericeira · Rapture","Buche eine private Surf-Ferienwohnung in Ericeira mit Meerblick am Strand und erlebe die volle Surfcamp-Erfahrung mit Rapture Surfcamps.","Published","Published"
"https://www.rapturecamps.com/blog/the-waves-in-nicaragua-are-always-offshore/","https://www.rapturecamps.com/de/blog/sind-die-wellen-in-nicaragua-immer-offshore/","Are the waves in Nicaragua are always offshore? · Rapture","Every surfer who travels to Nicaragua has heard that the waves are always offshore, but is this myth or an established fact? Read on to find out.","Sind die Wellen in Nicaragua immer offshore? · Rapture","Mythos oder Tatsache? Jeder Surfer, der nach Nicaragua reist, hat wohl gehört, dass die Wellen hier immer offshore sind. Aber ist dem so? Finde es heraus!","Published","Published"
"https://www.rapturecamps.com/blog/bali-temples-5-shrines-are-better-than-a-thousand/",,"BALI TEMPLES: 5 SHRINES ARE BETTER THAN A THOUSAND",,,,"Draft","Missing"
"https://www.rapturecamps.com/blog/buying-the-right-surfboard/",,"BUYING THE RIGHT SURFBOARD",,,,"Draft","Missing"
"https://www.rapturecamps.com/blog/the-real-bali-ubud-and-uluwatu/","https://www.rapturecamps.com/de/blog/sehenswuerdigkeiten-von-bali-ubud-und-uluwatu/","Places to See and Things to Do in Bali: Ubud and · Rapture","Discover the real Bali in Ubud and Uluwatu with this complete 2024 guide. Uncover a captivating journey through this tropical paradise.","Sehenswürdigkeiten I Ubud und Uluwatu · Rapture","Entdecke eine faszinierende Kultur: den Uluwatu-Tempel, Outdoor-Aktivitäten, majestätische Aussichten und Affen.","Published","Published"
"https://www.rapturecamps.com/blog/bali-currency-101-understanding-the-rupiah/",,"Bali Currency 101: Understanding the Rupiah",,,,"Draft","Missing"
"https://www.rapturecamps.com/blog/currency-bali/",,"Currency in Bali: Converter & Everything to Know · Rapture","Planning a trip to Bali? Find out about the local currency, exchange rates, and where to get the best deals.",,,"Published","Missing"
"https://www.rapturecamps.com/blog/nightlife-in-bali/",,"From Sunset to Sunrise: Top Spots To Enjoy Bali's · Rapture","Discover the best places to enjoy the lively Bali nightlife scene, whether you're looking for clubs, bars, or live music venues.",,,"Published","Missing"
"https://www.rapturecamps.com/blog/bali-nyepi-the-islands-day-of-silence/",,"Bali Nyepi: The Island’s Day Of Silence · Rapture","Every March, Bali hits pause. The streets empty, the beaches clear, and even the airport shuts down for a full 24 hours during Nyepi.",,,"Published","Missing"
"https://www.rapturecamps.com/blog/surf-resort-bali/","https://www.rapturecamps.com/de/blog/surf-hotel-bali/","Surf Resorts in Bali: Tropical Bliss and · Rapture","Looking for the perfect surf getaway? Look no further than a surf resort in Bali. Immerse yourself in scenic settings while riding epic waves.","Surf Resort Bali I Wellen im Paradies · Rapture","Genieße eine tolle Atmosphäre und lerne zu surfen, ohne auf eine komfortable Unterkunft zu verzichten. Besuche unsere Surf Resorts auf Bali!","Published","Published"
"https://www.rapturecamps.com/blog/surfing-bali/","https://www.rapturecamps.com/de/blog/surfen-bali/","Surfing in Bali Travel Tips & Best Surf · Rapture","Our comprehensive guide provides you with everything you need to know about surfing in Bali, including the best surf spots for your trip.","Surfen in Bali – Dein Abenteuer beginnt · Rapture","Komm auf die Insel der Götter und erlebe dein Surfabenteuer in Bali. Wir werden sicherstellen, dass du immer auf passenden Wellen reitest.","Published","Published"
"https://www.rapturecamps.com/blog/bali-weather-a-month-by-month/",,"Bali Weather: A Month-by-Month Guide For Surfers · Rapture","Whether your heading out to surf, or to chill by the beach, we cover everything there is to know about weather in Bali, from January to December.",,,"Published","Missing"
"https://www.rapturecamps.com/blog/saving-money-when-surfing-in-bali/","https://www.rapturecamps.com/de/blog/bali-mit-kleinem-budget-wie-surfen-ausserhalb-der-hauptsaison-geld-spart/","Bali on a Budget: How Off-Peak Surfing Saves You · Rapture","Planning your next Bali surfing getaway but don't want to break the bank? Learn how off-peak surfing can cut the costs of your next adventure","Bali mit kleinem Budget: Wie Surfen außerhalb der Hauptsaison Geld spart · Rapture","Du planst deinen nächsten Surfurlaub auf Bali, willst aber nicht zu viel Geld ausgeben? Erfahre, wie du beim Surfen außerhalb der Ferienzeit die Kosten für dein nächstes Abenteuer senken kannst","Published","Published"
"https://www.rapturecamps.com/blog/bali-vs-thailand/",,"Bali vs Thailand: Which Is The Better Surf · Rapture","In this blog we cover the differences between Bali vs Thailand and which one is best for your next surfing adventure.",,,"Published","Missing"
"https://www.rapturecamps.com/blog/balinese-massage/",,"Balinese Massage: Why You Should Try It: Best · Rapture","Balinese massage helps with: muscle recovery, improved circulation, stress relief, energy balancing, better sleep and skin benefits.",,,"Published","Missing"
"https://www.rapturecamps.com/blog/basic-surf-etiquette-how-to-survive-in-a-crowded-lineup/",,"Basic surf etiquette: How to survive in a crowded lineup",,,,"Draft","Missing"
"https://www.rapturecamps.com/blog/visit-batu-karas/",,"Batu Karas: Indonesia's Hidden Surf Gem: Top Surf · Rapture","Explore Batu Karas, Indonesia's hidden surf gem. Discover top surf spots, local culture, and plan your perfect surfing escape!",,,"Published","Missing"
"https://www.rapturecamps.com/blog/beach-things-to-do-in-bali/",,"Beach Things to Do in Bali",,,,"Draft","Missing"
"https://www.rapturecamps.com/blog/beginners-guide-to-wetsuits/","https://www.rapturecamps.com/de/blog/neoprenanzuege-fuer-anfaenger-warm-und-flexibel-bleiben-in-den-wellen/","Beginners Guide to Wetsuits · Rapture","To selecting the perfect thickness, fit, and features, this beginners wetsuit guide will cover everything you need to know. ","Anfängerleitfaden für Neoprenanzüge · Rapture","Um die perfekte Dicke, Passform und Eigenschaften auszuwählen, erfährst du in diesem Neoprenanzug-Guide für Anfänger alles, was du wissen musst.","Published","Published"
"https://www.rapturecamps.com/blog/bali-off-peak-surfing/",,"Beginners Paradise: Why Bali’s Off-Peak Season Is · Rapture","Even the pro's were beginners once. Explore why Bali in the off-peak season is the ideal spot for learning to surf.",,,"Published","Missing"
"https://www.rapturecamps.com/blog/benagil-cave/",,"Benagil Cave: A Guide to Portugal’s Coastal Spot · Rapture","Benagil Cave sits along the Algarve's dramatic limestone coast, about 150 meters from Praia de Benagil beach.",,,"Published","Missing"
"https://www.rapturecamps.com/blog/best-apps-for-surfers/",,"Best Apps For Surfers · Rapture","We’ve tested a bunch of surf apps and narrowed down the most useful ones for your surfing adventures in 2025. Find out more!",,,"Published","Missing"
"https://www.rapturecamps.com/blog/best-surf-bikinis/",,"Best Surf Bikinis: Comfort, Style, And Performance · Rapture","When it comes to a surf bikini, fit is everything. From handling powerful waves to duck dives, we discuss the best surf bikinis. Learn more!",,,"Published","Missing"
"https://www.rapturecamps.com/blog/is-our-surf-camp-near-lisbon-right-for-you/","https://www.rapturecamps.com/de/blog/ist-unser-surfcamp-in-der-nahe-von-lissabon-das-richtige-fur-dich/","The Right Surf Camp Near Lisbon For You · Rapture","Looking for the best surf camp near Lisbon? Enjoy daily breakfast, free Wifi, theory lessons, certified surf lessons, Yoga and more!","Du suchst ein Surfcamp der Nähe von Lissabon · Rapture","Du suchst ein Surfcamp in Ericeira, in der Nähe von Lissabon? Wir haben einige Gründe für dich aufgelistet, warum unser Camp perfekt für dich ist!","Published","Published"
"https://www.rapturecamps.com/blog/7-best-surf-movies-of-all-time/",,"7 Must-Watch Surf Movies · Rapture","Looking for some thrilling surf movies for inspiration? This list of the 7 best surf movies will leave you ready to hit the beach!",,,"Published","Missing"
"https://www.rapturecamps.com/blog/portugal-best-surf-spots/","https://www.rapturecamps.com/de/blog/die-7-besten-surfspots-portugals/","Portugal's Surfing Hotspots: 20 Best Surf Breaks · Rapture","Find out the best places to surf in beautiful, sunny Portugal. Find details on 7 of Portugal's surfing hotspots. Plan your next adventure!","Portugals beste Spots um zu Surfen · Rapture","Finde die besten Orte, um im schönen, sonnigen Portugal zu surfen. In diesem Ratgeber sagen wir dir, wo die 7 besten Surf-Gegenden Portugals liegen.","Published","Published"
"https://www.rapturecamps.com/blog/exploring-costa-ricas-surf-culture/","https://www.rapturecamps.com/de/blog/costa-ricas-surf-kultur-erkunden/","Beyond The Break: Exploring Costa Rica's Surf · Rapture","Learn Costa Rica's true surf culture and how it pulses in the veins of salt-crusted locals and adventure-seeking nomads alike.","Jenseits der Brandung: Costa Ricas Surfkultur erforschen · Rapture","Lerne Costa Ricas wahre Surfkultur kennen und erfahre, wie sie in den Adern von salzverkrusteten Einheimischen und abenteuerlustigen Nomaden gleichermaßen pulsiert.","Published","Published"
"https://www.rapturecamps.com/blog/bingin-beach/",,"Bingin Beach, Bali: A Surfer’s Dream Playground · Rapture","Discover Bingin Beach, Bali - a top surf destination known for its consistent waves, stunning cliffs, and laid-back charm.",,,"Published","Missing"
"https://www.rapturecamps.com/blog/bioluminescence-in-costa-rica/",,"Bioluminescence In Costa Rica · Rapture","Bioluminescence has turned Costa Rica's Isla de Cedros into a bucket-list destination for adventure seekers. Learn how to see this dazzling phenomenon.",,,"Published","Missing"
"https://www.rapturecamps.com/blog/bodyboarding-tips-and-tricks/",,"Bodyboarding Tips And Tricks: How To Improve Your · Rapture","We've rounded up the best tips and tricks to take your bodyboarding game to the next level. Grab your fins and get ready to carve.",,,"Published","Missing"
"https://www.rapturecamps.com/blog/what-to-look-for-when-booking-a-surf-camp/","https://www.rapturecamps.com/de/blog/surfcamp-buchen-darauf-solltest-du-bei-deiner-entscheidung-achten/","What to look for when booking a Surfcamp · Rapture","With so many options out there, booking a surf camp can be overwhelming. Read on to discover what you should look for in a surf camp with Rapture.","Surfcamp buchen I Entscheidungshilfen · Rapture","Du bist dir nicht sicher, welches Surfcamp du buchen sollst? Wir zeigen dir, worauf bei der Buchung eines Surfcamps zu achten ist.","Published","Published"
"https://www.rapturecamps.com/blog/what-is-the-diving-reflex/",,"Can The Diving Reflex Help You Stay Calm · Rapture","In this blog post, we'll delve into the fascinating science behind the diving reflex and how it can help surfers stay calm underwater.",,,"Published","Missing"
"https://www.rapturecamps.com/blog/can-you-surf-without-knowing-how-to-swim/",,"Can you surf without knowing how to swim?",,,,"Draft","Missing"
"https://www.rapturecamps.com/blog/catch-the-perfect-wave-a-surfers-handbook-to-canggu/",,"Catch The Perfect Wave: A Surfer's Handbook To · Rapture","Canggu is a surfer's paradise tucked away on Bali's southwestern coast and offers waves for every skill level.",,,"Published","Missing"
"https://www.rapturecamps.com/blog/beginners-guide-to-ericeira/",,"Catch the Perfect Wave: A Beginner’s Guide to · Rapture","With its year-round waves and abundance of surf camps and instructors, Ericeira is the perfect place to start your surfing adventure.",,,"Published","Missing"
"https://www.rapturecamps.com/blog/advanced-surf-spots-in-costa-rica/","https://www.rapturecamps.com/de/blog/fortgeschrittene-surfspots-in-costa-rica/","Chasing the Perfect Wave: Advanced Surf Spots in · Rapture","Are you ready to ride some of the most exhilarating waves in the world? We reveal the most advanced surf spots costa rica.","Auf der Jagd nach der perfekten Welle: Fortgeschrittene Surfspots in Costa Rica · Rapture","Bist du bereit, einige der aufregendsten Wellen der Welt zu reiten? Wir enthüllen die fortschrittlichsten Surfspots in Costa Rica.","Published","Published"
"https://www.rapturecamps.com/blog/chasing-the-perfect-wave-advanced-surf-spots-in-costa-rica/",,"Chasing the Perfect Wave: Advanced Surf Spots in Costa Rica",,,,"Draft","Missing"
"https://www.rapturecamps.com/blog/choosing-the-perfect-surf-travel-bag-for-your-adventure/",,"Choosing The Perfect Surf Travel Bag For Your · Rapture","A good surf travel bag shields your board from dings, keeps it cool, and makes hauling gear a breeze. So which one should you choose?",,,"Published","Missing"
"https://www.rapturecamps.com/blog/how-to-book-a-surf-camp-in-bali/","https://www.rapturecamps.com/de/blog/was-du-wissen-solltest-bevor-du-ein-surfcamp-in-bali-buchst/","Choosing the Right Surf Camp in Bali · Rapture","Looking for the best beginner surf camp in Bali? This comprehensive guide will help answer some common questions that beginners ask.","Infos für deine Surfcamp Bali Buchung · Rapture","Wenn du Fragen dazu hast, wann du ein Surfcamp in Bali buchen sollst, welche Art von Übernachtungspaketen wir anbieten, hilft dir dieser Artikel weiter.","Published","Published"
"https://www.rapturecamps.com/blog/beach-hotels-in-costa-rica/",,"What to Look for in Beach Hotels in Costa Rica · Rapture","Here’s a quick guide to help you navigate this palm-fringed paradise to find the ideal spot for your next Costa Rica surfing adventure.",,,"Published","Missing"
"https://www.rapturecamps.com/blog/co-living-ericeira-villa/","https://www.rapturecamps.com/de/blog/co-living-ericeira-villa/","Co-Living Ericeira, Portugal · Rapture","Want to try co-living in Ericeira? This guide teaches you about the co-living and co-working possibilities in this charming Portuguese town.","Co-Living Ericeira, Portugal · Rapture","Komme in dein zweites zu Hause: Co-Living Ericeira. Entspanne mit Meerblick, am Pool und beim Surfen in unserer Surf Villa Ericeira.","Published","Published"
"https://www.rapturecamps.com/blog/common-surfing-injuries/",,"Common Surfing Injuries And How To Prevent Them · Rapture","From cuts and scrapes to jellyfish stings we cover some of the most common surfing injuries and how you can avoid them.",,,"Published","Missing"
"https://www.rapturecamps.com/blog/how-to-read-waves/",,"How to Read Waves: Techniques and Tips · Rapture","Understanding how to read waves is essential for any surfer. Dive into this guide to learn the tricks and tips to help you conquer the waves.",,,"Published","Missing"
"https://www.rapturecamps.com/blog/costa-nova-portugal/",,"Costa Nova: Portugal’s Most Colorful Coastal Gem · Rapture","Costa Nova delivers a perfect blend of surf culture, traditional Portuguese life, and natural beauty. Learn more!",,,"Published","Missing"
"https://www.rapturecamps.com/blog/costa-rica-monsoon-season/",,"Costa Rica Monsoon Season: Surf Conditions and How · Rapture","From May to November, Costa Rica's monsoon season, the country transforms into a surfer's paradise, offering larger, more consistent waves.",,,"Published","Missing"
"https://www.rapturecamps.com/blog/renewable-energy-plastic-carbon-free-costa-rica/","https://www.rapturecamps.com/de/blog/costa-rica-erneuerbare-energien-plastikfrei-und-co-2-neutral-bis-2021/","Costa Rica Renewable Energy -Plastic & Carbon Free · Rapture","Costa Rica’s energy has been 99% produced by renewable energy sources. Now Costa Rica wants to be the first country to become plastic-free and carbon-free.","Costa Rica Plastikfrei bis 2021? · Rapture","In den letzten 5 Jahren wurden 99% erneuerbare Energien in Costa Rica hauptsächlich durch Sonnen- und Wasserkraft gewonnen.","Published","Published"
"https://www.rapturecamps.com/blog/costa-rica-travel-guide-best-places-activities-travel-tips/",,"Costa Rica Travel Guide: Best Places, Activities & · Rapture","Want to experience paradise? Discover when to visit, where to stay and how to make the most of your Costa Rican escape.",,,"Published","Missing"
"https://www.rapturecamps.com/blog/sintra-portugals-fairytale-town/",,"Discover Sintra: Portugal’s Fairytale Town · Rapture","This UNESCO-listed town, with its candy-colored palaces and misty hills, offers the perfect counterpoint to morning surf sessions.",,,"Published","Missing"
"https://www.rapturecamps.com/blog/best-surf-camps-in-europe-2024/",,"The 9 Best Surf Camps in Europe in 2024 · Rapture","Whether you’re a total novice or a seasoned pro, discover our guide on the 9 best surf camps in Europe in 2024.",,,"Published","Missing"
"https://www.rapturecamps.com/blog/surfing-bali-experienced/",,"Surfing in Bali for Experts: Surf Camps in Bali · Rapture","Are you an experienced surfer looking for the ultimate wave in Bali? Learn about the best season in this expert's guide to surfing Bali.",,,"Published","Missing"
"https://www.rapturecamps.com/blog/do-surfers-struggle-on-surfboards/",,"Do Surfers Struggle On Surfboards? · Rapture","Beginner, intermediate or expert, all surfers struggle on the waves. We cover the common challenges faced by surfers at every skill level.",,,"Published","Missing"
"https://www.rapturecamps.com/blog/swimming-skills-surfing/",,"Swimming Skills For Surfing: Is It Important? · Rapture","Dive into this guide to know the importance of knowing how to swim for surfers and its role in your safety and performance in the water.",,,"Published","Missing"
"https://www.rapturecamps.com/blog/dominical-costa-rica/",,"Dominical, Costa Rica: Surfing, Yoga, And · Rapture","Dominical offers what many surfers consider paradise: consistent waves, a relaxed atmosphere, and a tranquil escape.",,,"Published","Missing"
"https://www.rapturecamps.com/blog/donegal-bay-mullaghmore-ireland/",,"Donegal Bay’s Mullaghmore: Ireland’s Answer To Big · Rapture","When winter storms barrel across the Atlantic and waves reach 50+ feet, Donegal Bay becomes a proving ground for the world's best surfers.",,,"Published","Missing"
"https://www.rapturecamps.com/blog/dreamland-beach-bali/",,"Dreamland Beach: Bali’s Hidden Paradise For · Rapture","Dreamland's waves offer something for everyone. The main peak delivers consistent waves typically ranging from 3 to 8 feet.",,,"Published","Missing"
"https://www.rapturecamps.com/blog/what-is-duck-diving/",,"Duck Diving: Techniques For Surfers · Rapture","Push the nose of the surfboard under an oncoming wave while simultaneously pressing down on the tail with your knee or back foot.",,,"Published","Missing"
"https://www.rapturecamps.com/blog/eco-surf-rescue-uluwatu/","https://www.rapturecamps.com/de/blog/eco-surf-rescue-uluwatu/","Eco Surf Rescue Uluwatu: Sustainable Surfing · Rapture","Uluwatu's temple and as one of the best surfing beaches in the world. Read on to see why the awareness on this topic is so important.","Eco Surf Rescue Uluwatu! Öko Surf Rettung Uluwatu! · Rapture","Der Tempel von Uluwatu und einer der bestenSurfstrände der Welt. Entdecken Sie die Ziele von Eco Surf Rescue (ÖkoSurf Rettung): die Stärkung des Umweltbewusstseins und dieVerbesserung des Umweltschutzes.","Published","Published"
"https://www.rapturecamps.com/blog/eco-friendly-surfboards/",,"Eco-Friendly Surfboards: What You Need To Know · Rapture","With climate concerns rising, surfers are asking questions about what their boards are made of. Learn about eco-friendly surfboards!",,,"Published","Missing"
"https://www.rapturecamps.com/blog/ericeira-portugal-part-of-first-international-surf-network/","https://www.rapturecamps.com/de/blog/ericeira-portugal-euorpa-surfspots/","Ericeira in the 1st International Surf Network · Rapture","Surfing in Ericeira: Europe's is part of the First International Surf Network, definitely one of the best surfing spots in Europe","Europas Top Surf Adresse I Ericeira · Rapture","Ericeira: Europas Top Gebiet der World Surfing Reserve und Teil des ersten internationalen Surf-Netzwerks. Einer der besten SurfSpots Europas","Published","Published"
"https://www.rapturecamps.com/blog/avoid-crowd-and-catch-more-waves-in-bali/","https://www.rapturecamps.com/de/blog/surfen-lernen-auf-bali-ohne-crowd/","Catch Waves and Not Crowds!: 5 Tips to Avoid · Rapture","Tired of fighting the crowds for a wave in Bali? Discover insider tips to avoid the masses and find your own slice of surfing paradise.","Massen im Wasser vermeiden · Rapture","Du möchtest auf Bali surfen lernen, aber hast keine Lust auf volle Line-Ups? Dieser Artikel erklärt dir, wie du Massen vermeiden kannst.","Published","Published"
"https://www.rapturecamps.com/blog/surfers-ear/",,"Everything You Need To Know About Surfer's Ear · Rapture","Surfer's ear is a condition where bone grows in the ear canal as a response to repeated exposure to cold water and wind.",,,"Published","Missing"
"https://www.rapturecamps.com/blog/barrel-riding-basics/",,"Expert Surfing 101: Riding a Barrel · Rapture","Dreaming of catching the perfect barrel? This comprehensive guide will teach you basics learn riding the tube and dominating the waves.",,,"Published","Missing"
"https://www.rapturecamps.com/blog/exploring-the-best-portugal-surf-spots-essential-tips-and-must-visit-locations/",,"Exploring The Best Portugal Surf Spots: Essential Tips And Must-Visit Locations",,,,"Draft","Missing"
"https://www.rapturecamps.com/blog/find-crowd-free-waves-for-surfing-in-vila-nove-de-milfontes/",,"Find Crowd-free Waves For Surfing In Vila Nove de Milfontes",,,,"Draft","Missing"
"https://www.rapturecamps.com/blog/what-is-foil-surfing/",,"Foil Surfing: The Future Of Wave Riding · Rapture","Foil surfing involves riding a surfboard equipped with a hydrofoil mounted beneath the board that lifts it above the water’s surface.",,,"Published","Missing"
"https://www.rapturecamps.com/blog/frequently-asked-questions-about-our-surf-camp-in-costa-rica/",,"Frequently asked questions about our surf camp in Costa Rica",,,,"Draft","Missing"
"https://www.rapturecamps.com/blog/the-definitive-surfers-guide-to-lisbon/","https://www.rapturecamps.com/de/blog/der-ultimative-lissabon-guide-die-besten-orte-furs-essen-entspannen-und-surfen/","The definitive Surfer’s Guide to Lisbon · Rapture","Uncover the Portuguese capital’s best beaches, taste it’s most spectacular food and experience all that it has to offer in our Lisbon city guide.","Der ultimative Lissabon Guide · Rapture","Lissabon scheint ein Mekka für alles zu sein, was köstlich, interessant, lustig und schön ist. Lies unseren Guide, was du auf keinen Fall verpassen darfst!","Published","Published"
"https://www.rapturecamps.com/blog/surf-school-costa-rica/","https://www.rapturecamps.com/de/blog/surfschule-costa-rica/","Surf School Costa Rica: All Levels · Rapture","Discover the ultimate surf experience in Costa Rica with Rapturecamps Surf School. Learn to ride the waves in the land of Pura Vida.","Surfschule Costa Rica - Beginner zum Profi · Rapture","Lerne die beste Surfschule in Costa Rica kennen - Rapture Surfcamps Cost Rica. Der ultimative Surfunterricht mit erfahrenen Lehrern.","Published","Published"
"https://www.rapturecamps.com/blog/yoga-surfcamp-portugal/","https://www.rapturecamps.com/de/blog/yoga-surfcamp-portugal/","Yoga Surfcamp Portugal - Join us in Ericeira · Rapture","Join us for an unforgettable yoga surf camp experience in Portugal. Find your inner zen with daily yoga sessions with surf lessons in Portugal.","Yoga & Surfen Surfcamp in Portugal · Rapture","Yoga und Surfen gehören zusammen. Sie ergänzen sich in Bezug auf körperliche Fitness in Bereichen wie Balance, Flexibilität, Stärke und Kontrolle.","Published","Published"
"https://www.rapturecamps.com/blog/bali-surf-camps-all-level-surf-lessons/",,"Surf Lessons in Bali for Beginner, Intermediate · Rapture","Ready to catch some waves in Bali? Join our surf camp for beginners, intermediates, and experts and experience the thrill of surfing in paradise.",,,"Published","Missing"
