EN URL,DE URL,EN Meta Title,EN Meta Description,DE Meta Title,DE Meta Description,EN Status,DE Status
"https://www.rapturecamps.com/blog/10-dream-surfing-destinations-for-2024/",,"Best Places in the World to Surf: 10 Dream Surf · Rapture","Discover the best places in the world to surf, from Hawaii's iconic waves to Morocco's hidden gems. Start planning your 2025 surf adventure!",,,"Published","Missing"
"https://www.rapturecamps.com/blog/10-best-surf-spots-in-bali/","https://www.rapturecamps.com/de/blog/10-besten-surfspots-in-bali/","10 Best Surf Spots in Bali: Map, Videos · Rapture","We've narrowed down the top 10 surf breaks just for you. Get ready for an epic adventure on Bali's world-renowned waves.","Die 10 besten Surf-Spots auf Bali · Rapture","Auf der Suche nach dem besten Surf-Spot auf Bali? Bali ist ein Paradies für Surfer. Schau dir unseren Guide zu den besten Plätzen fürs Wellenreiten an!","Published","Published"
"https://www.rapturecamps.com/blog/top-10-surfing-destinations-in-the-world/","https://www.rapturecamps.com/de/blog/die-10-besten-surfspots-der-welt/","10 Places to Surf in the World · Rapture","Explore the 10 best surfing destinations in the world. Discover the best times to visit and plan your ultimate 2025 surfing adventure with Rapture Surfcamps!","10 Orte zum Surfen auf der Welt | 2023 · Rapture","Schau dir unsere Liste der 10 besten Orte zum Surfen auf der Welt an und die besten Zeiten, um diese Orte für den perfekten Surfurlaub zu besuchen.","Published","Published"
"https://www.rapturecamps.com/blog/10-best-things-to-do-in-monteverde-cloud-forest/",,"10 Best Things To Do In Monteverde Cloud Forest · Rapture","Spanning over 26,000 acres across multiple reserves, Monteverde Cloud Forest is the ideal place for nature enthusiasts from around the world.",,,"Published","Missing"
"https://www.rapturecamps.com/blog/10-gruende-noch-heute-mit-dem-surfen-anzufangen/",,"10 Gründe, noch heute mit dem Surfen anzufangen!",,,,"Draft","Missing"
"https://www.rapturecamps.com/blog/reasons-to-start-surfing-today/","https://www.rapturecamps.com/de/blog/10-gruende-noch-heute-mit-dem-surfen-anzufangen/","10 Reasons to Start Surfing Today! · Rapture","Have you ever thought about learning how to surf? Here are 10 compelling reasons why you should start hitting the waves today!","10 Gründe, noch heute mit dem Surfen anzufangen! · Rapture","Haben Sie schon einmal daran gedacht, Surfen zu lernen? Hier sind 10 überzeugende Gründe, warum Sie noch heute in die Wellen gehen sollten!","Published","Published"
"https://www.rapturecamps.com/blog/surfing-safety-in-ocean/",,"The Ultimate Guide to Surfing Safely Tips · Rapture","Hear from professionals how to navigate the waves, avoid hazards, and protect yourself while riding the waves.",,,"Published","Missing"
"https://www.rapturecamps.com/blog/10-things-to-do-playa-avellanas-costa-rica/","https://www.rapturecamps.com/de/blog/die-top-10-aktivitaeten-in-costa-rica-playa-avellanas/","10 Things to do in Playa Avellanas Guide · Rapture","Get an accurate lowdown on the 10 best things to do beyond surfing for your trip to Costa Rica's Playa Avellanas!","Aktivitäten in Playa Avellanas, Costa Rica · Rapture","Es gibt eine Menge Aktivitäten in Playa Avellanas neben dem Surfen! Schorcheln, Wandern im Dschungel, Schwimmen unter Wasserfällen..","Published","Published"
"https://www.rapturecamps.com/blog/10-fun-things-to-do-in-costa-rica/",,"10 Incredibly Fun Things To Do In Costa Rica · Rapture","A surf trip to Costa Rica? Why not! Read on to discover all the other cool and unique things you can do here besides hitting the waves.",,,"Published","Missing"
"https://www.rapturecamps.com/blog/budget-surf-trips-10-ways-to-save-money/",,"10 Ways to Save Money-Enjoy Budget Surf Trips · Rapture","Use these budget surf trip tips to save some cash. The less money you spend on flights, the more you can spend on accommodation.",,,"Published","Missing"
"https://www.rapturecamps.com/blog/best-surf-spots-in-morocco/",,"Surfing in Morocco: Top 10 Spots · Rapture","Discover the top 10 spots for surfing in Morocco for beginner, intermediate and advanced surfers with all the details here!",,,"Published","Missing"
"https://www.rapturecamps.com/blog/things-to-do-in-morocco/",,"Top 11 Places to Visit in Morocco Guide · Rapture","Planning a trip to Morocco? Here are the 11 places you must visit in Morocco with tips on what to do and see here!",,,"Published","Missing"
"https://www.rapturecamps.com/blog/15-tips-to-get-better-at-surfing-tips-for-all-levels-of-surfers/",,"15 ACTIONABLE Tips for Surfing: Surf like a Pro · Rapture","Improve your surfing game with these 15 tips that can help everyone from beginners to expert surfers.",,,"Published","Missing"
"https://www.rapturecamps.com/blog/best-things-to-do-in-ericeira/","https://www.rapturecamps.com/de/blog/10-dinge-die-man-im-schonen-ericeira-gesehen-haben-muss-ein-top-surfziel-in-portugal/","12 Amazing Things You Can't Miss in Ericeira · Rapture","Planning on surfing in this beautiful seaside town in Portugal? Here are the best things you can’t miss out while staying at our surf camp in Ericeira.","Surfen in Ericeira - 10 Top Aktivitäten · Rapture","Du planst deine Reise in unser Ericeira Camp? Hier sind 10 Dinge für dich, die du bei deinem Aufenthalt auf keinen Fall verpassen darfst.","Published","Published"
"https://www.rapturecamps.com/blog/what-to-pack-for-costa-rica-and-nicaragua/","https://www.rapturecamps.com/de/blog/packliste-fur-deine-reise-nach-costa-rica-nicaragua/","What to Pack for Nicaragua and Costa Rica? · Rapture","Wondering what to pack for Costa Rica and Nicaragua? Discover all the essential items needed for a trip to these tropical countries in Central America.","Packliste für Nicaragua und Costa Rica · Rapture","Wir können es kaum erwarten, dir die Schönheit dieses Paradieses namens Mittelamerika zu zeigen. Komm und besuch uns in Costa RIca oder Nicaragua","Published","Published"
"https://www.rapturecamps.com/blog/surfing-nicaragua/","https://www.rapturecamps.com/de/blog/surfing-nicaragua/","Surfing in Nicaragua: Best Surf Spots – Best · Rapture","Planning a surf trip to Nicaragua in 2024?Find the best surf spots and seasons to help you make the most of your time on the waves","Surfen in Nicaragua · Rapture","Müde von Surfen in Bali, Australien oder der Westküste? Komm und entdecke die unglaublich leerenWellen in einem tropischen Paradies – Surfen in Nicaragua steht auf deiner Liste!","Published","Published"
"https://www.rapturecamps.com/blog/new-years-resolution-for-surfers/",,"4 New Year's Resolutions for Surfers · Rapture","Make 2024 your best year in the water yet! Here are 4 ACTIONABLE resolutions to help you become a stronger, more confident surfer.",,,"Published","Missing"
"https://www.rapturecamps.com/blog/fun-facts-about-portugal/",,"22 Fun Facts About Portugal That Prove It's a · Rapture","From the waves of Nazaré to to the soulful influence of Fado music, learn 22 facts that reveal why Portugal is hailed as a surfer's paradise.",,,"Published","Missing"
"https://www.rapturecamps.com/blog/why-is-surfing-popular/",,"29 Reasons Why Everyone Loves Surfing · Rapture","In recent years surf culture has spread around the world and is now bigger than ever. But why is surfing popular? We provide 29 great reasons!",,,"Published","Missing"
"https://www.rapturecamps.com/blog/3-beaches-you-must-visit-in-sanur-other-than-sanur-beach/",,"3 Beaches You Must Visit in Sanur(other than Sanur Beach)",,,,"Draft","Missing"
"https://www.rapturecamps.com/blog/3-off-beat-places-you-must-visit-in-bali/",,"3 Off-beat Places You Must Visit in Bali",,,,"Draft","Missing"
"https://www.rapturecamps.com/blog/3-things-to-do-in-and-around-sanur/",,"3 Things To Do In and Around Sanur",,,,"Draft","Missing"
"https://www.rapturecamps.com/blog/3-yoga-poses-before-surfing/",,"3 Yoga Poses To Help You Warm Up Before Surfing · Rapture","Before you catch the waves, try these three pre-surf yoga poses that will prepare your body and mind for an amazing surfing experience.",,,"Published","Missing"
"https://www.rapturecamps.com/blog/surf-lessons-in-portugal/","https://www.rapturecamps.com/de/blog/surfschule-portugal/","Surf Lessons in Portugal: Choose the Right Place · Rapture","Ready to hit the waves in Portugal? Before you book your surf lessons, read these four tips to make sure you are making the right choice.","Unsere Surfschule in Ericeira · Rapture","Buche unsere Surfschule in Ericeira, Portugal. Unsere erfahrenen Surflehrer werden dir helfen, in kürzester Zeit eine gute Welle zu erwischen!","Published","Published"
"https://www.rapturecamps.com/blog/speak-like-a-surfer/",,"47 Surfing Terms You Must Know to Speak like a · Rapture","Want to learn surfing terms? Here are 47 easy-to-learn surfing terms that can help you speak like a seasoned surfer!",,,"Published","Missing"
"https://www.rapturecamps.com/blog/the-5-best-places-to-learn-to-surf/","https://www.rapturecamps.com/de/blog/die-5-besten-orte-um-surfen-zu-lernen-rapture-surfcamps/","Want to Learn to Surf? Top 5 Places in the World · Rapture","Explore the 5 best places in the world to learn to surf. From Bali to Nicaragua, embark on catch your first wave!","Die 5 besten Orte, um Surfen zu lernen · Rapture","Du bist bereit für den nächsten Trip. weißt aber nicht, wohin? Lies unseren Guide zu den 5 besten Orten, an denen du Surfen lernen kannst.","Published","Published"
"https://www.rapturecamps.com/blog/common-surfing-mistakes/",,"5 Common Surfing Mistakes: Get Better At Surfing · Rapture","Are you making these common surfing mistakes? Discover the most common errors beginners make and how to correct them in this blog.",,,"Published","Missing"
"https://www.rapturecamps.com/blog/5-reasons-rapture-offers-the-best-surfing-in-portugal/",,"5 Reasons Our Surf Camp Offers the Best Surfing in · Rapture","From hitting the waves to relaxing with a cocktail, discover why Rapture boasts some of the best surf camps in Portugal!",,,"Published","Missing"
"https://www.rapturecamps.com/blog/5-of-the-best-beginner-surf-beaches-in-costa-rica/","https://www.rapturecamps.com/de/blog/5-der-besten-surf-anfangerstrande-in-costa-rica/","Top 5 Surf Spots in Costa Rica: Location, Wave · Rapture","Discover 5 of the best beginner surf beaches in Costa Rica and everything you need to know about them before booking your surf trip!","5 der besten Anfänger Surfstrände in Costa Rica · Rapture","5 der besten Anfänger Surfstrände in Costa Rica. Buche noch heute mit Rapture Surfcamps eine Reise zu deinen mellow Wellen in Mittelamerika.","Published","Published"
"https://www.rapturecamps.com/blog/5-vegan-restaurants-you-must-visit-in-bali/","https://www.rapturecamps.com/de/blog/5-vegane-restaurants-die-sie-auf-bali-unbedingt-besuchen-muessen/","Vegan Restaurants in Bali: Top 5 Restaurants for · Rapture","Explore the top 5 vegan restaurants in Bali for 2024. From smoothie bowls to vegan burgers, we've got you covered!","Vegane Restaurants in Bali | Top 5 Restaurants für 2024 · Rapture","Entdecken Sie die 5 besten veganen Restaurants in Bali für 2024. Von Smoothie Bowls bis hin zu veganen Burgern - wir haben alles für Sie!","Published","Published"
"https://www.rapturecamps.com/blog/6-best-places-to-surf-in-august-2025/",,"6 Best Places to Surf in August 2025 · Rapture","Discover the Best Places to Surf in August! From Bali to Portugal, explore epic waves, warm waters, and vibrant surf scenes. Learn more!",,,"Published","Missing"
"https://www.rapturecamps.com/blog/traveling-with-a-surfboard-made-easy-in-6-simple-steps/","https://www.rapturecamps.com/de/blog/6-hilfreiche-tipps-zum-reisen-mit-dem-surfboard/","Travelling with a surfboard: Tips and FAQs · Rapture","How should I pack my surfboard for a flight? Are there fees for transporting surfboards? Learn everything about travelling with a surfboard!","Tips für deine Reise mit Surfboard · Rapture","Das Reisen mit dem Surfbrett kann ein echter Alptraum sein. Hier erfährst du, wie du das Drama des Fliegens mit einem Board vermeidest und Geld sparst.","Published","Published"
"https://www.rapturecamps.com/blog/get-better-at-surfing/","https://www.rapturecamps.com/de/blog/besser-im-surfen-werden/","6 Proven Tips on How to Get Better at Surfing · Rapture","Surfing is tough right? We all have dreams of ripping waves like Kelly Slater or Carissa Moore. But how do you get better at surfing ?","6 bewährte Tipps, wie man besser im Surfen wird · Rapture","Surfen ist hart, oder? Wir alle träumen davon, Wellen wie Kelly Slater oder Carissa Moore zu reiten. Aber wie wird man besser im Surfen?","Published","Published"
"https://www.rapturecamps.com/blog/why-choose-nicaragua-as-your-first-surf-trip/","https://www.rapturecamps.com/de/blog/6-grunde-fur-deinen-ersten-surfurlaub-in-nicaragua/","6 Reasons Nicaragua Should Be Your Surf · Rapture","Ready to embark on your very first overseas surfing adventure? Do yourself a favor and book a surf trip to Nicaragua with Rapture Surfcamps today.","6 Gründe für einen Surfurlaub in Nicaragua · Rapture","Du bist bereit, deinen allerersten Surfurlaub in Nicaragua zu starten? Dann buche jetzt deinen Urlaub bei uns im Rapture Surfcamps.","Published","Published"
"https://www.rapturecamps.com/blog/tips-for-surfing-in-costa-rica-on-a-budget/",,"Surf Costa Rica on a Shoestring: 6 Tried and · Rapture","Want to go for a surf trip to Costa Rica that doesn’t break the bank? Consider booking a stay with Rapture Surfcamps and surfing on a budget.",,,"Published","Missing"
"https://www.rapturecamps.com/blog/6-types-of-guests-you-can-expect-to-meet-at-our-portugal-surf-camp/","https://www.rapturecamps.com/de/blog/6-typen-von-gaesten-die-du-in-unserem-surfcamp-in-portugal-antreffen-wirst/","Surf Camp Guests you will meet here · Rapture","Learn all about the surfcamp guests you’re guaranteed to run into the next time you book a stay at our Portugal surf camp in Ericeira.","6 Typen von Surfcamp-Gästen, die garantiert antreffen wirst · Rapture","Entdecke und triff faszinierende Menschen während deines Aufenthalts im Rapture Portugal-Surfcamp. Dein Surf-Abenteuer beginnt hier.","Published","Published"
"https://www.rapturecamps.com/blog/how-to-improve-your-surfing-in-6-easy-steps/","https://www.rapturecamps.com/de/blog/6-tipps-wie-du-dein-surfen-verbessern-kannst/","How to improve your surfing in 6 easy steps · Rapture","We call it surfer’s froth the feeling every beginner gets when they’re ready to take their skills to the next level and start to surf unbroken waves.","6 Tipps wie du dein Surfen verbessern kannst · Rapture","Wir haben einige Tipps für dich zusammengeschrieben, wie du in wenigen Schritten dein Surfen um einiges verbessern kannst!","Published","Published"
"https://www.rapturecamps.com/blog/6-of-the-best-tips-for-beginner-surfers/","https://www.rapturecamps.com/de/blog/6-der-besten-tipps-fuer-surfanfaenger/","6 of the Best Tips for Beginner Surfers · Rapture","Check out some of our best tips for beginner surfers and take your wave riding skills to the next level with Rapture Surfcamps","6 der besten Tipps für Surfanfänger · Rapture","Entdecke einige unserer besten Tipps für Surfanfänger und verbessere deine Wellenreitfähigkeiten mit Rapture Surfcamps","Published","Published"
"https://www.rapturecamps.com/blog/things-to-do-portugal/","https://www.rapturecamps.com/de/blog/portugal-was-du-unbedingt-sehen-und-tuen-solltest/","7 BEST Places to Visit and Things to Do in · Rapture","Check out our tips for activities around Ericeira, for those rare flat days. There are lots of things to do in Portugal, except surfing of course.","Umgebung Ericeira - Portugal erkunden · Rapture","Es gibt die Tage, an denen dur eine Pause vom Surfen brauchst. In der Umgebung um Ericeira gibt es einige Schätze Portugals zu entdecken!","Published","Published"
"https://www.rapturecamps.com/blog/book-surf-camp/",,"7 Reasons To Book A Surf Camp In 2024 · Rapture","Turn your next vacation into a wave riding adventure by booking a surf camp with Rapture Surfcamps! Here are 7 reasons why you should do it!",,,"Published","Missing"
"https://www.rapturecamps.com/blog/things-to-do-gili-islands/","https://www.rapturecamps.com/de/blog/7-dinge-die-du-auf-den-gili-inseln-tun-kannst/","7 Fun Things To Do In Gili Islands: All · Rapture","Plan your trip to the Gili Islands with this comprehensive guide. Get details on transport options, costs, and activities.","7 Dinge, die du auf den Gili Inseln tun kannst · Rapture","Hier kannst du Surfen, Tauchen, oder einfach nur unter Palmen Relaxen. Erfahre mehr über die Gili-Inseln, Asiens unberührtes Paradies","Published","Published"
"https://www.rapturecamps.com/blog/7-things-to-know-before-surfing/",,"Plan to Learn Surfing? 7 Things You Should Know · Rapture","Hit the waves fully prepared with these seven essential tips for learning how to surf. From equipment to safety, we've got you covered!",,,"Published","Missing"
"https://www.rapturecamps.com/blog/7-ways-to-stay-in-shape-when-youre-not-surfing/","https://www.rapturecamps.com/de/blog/7-tips-um-auch-ohne-surfen-fit-zu-bleiben/","Stay in Shape even When not Surfing: 7 Essential · Rapture","It's important to stay in shape even when you're not in the water. Use these tips to keep your surf fitness maintained in between surf sessions!","7 Tips um auch ohne Surfen fit zu bleiben · Rapture","Surfen ist ein sehr energiereicher Sport. Wenn du im Surfen wirklich erfolgreich werden willst, darfst du natürlich das Training nicht vergessen","Published","Published"
"https://www.rapturecamps.com/blog/7-of-the-weirdest-waves-around-the-world-and-where-to-find-them/","https://www.rapturecamps.com/de/blog/7-der-verrucktesten-wellen-der-welt-und-wo-du-sie-findest/","7 Weirdest Waves to Surf: Unique Surf Spots You · Rapture","Explore the world's quirkiest waves in our blog post! Discover 7 unusual surf spots and their unique locations","7 der Verrücktesten Wellen der Welt · Rapture","Zieh das Salzwasser ab und füge ganz viel Abenteuer und Spaß dazu - heraus kommen die verrücktesten Wellen der Welt. Finde heraus wo sie zu finden sind.","Published","Published"
"https://www.rapturecamps.com/blog/7-biggest-waves-in-the-world/",,"7 Biggest Waves in the World: Stats, Images · Rapture","Learn more about the 7 of the biggest waves in the world where you can experience the thrill of monster swells like never before.",,,"Published","Missing"
"https://www.rapturecamps.com/blog/8-best-places-to-learn-to-surf/",,"8 Best Places to Learn How to Surf: Find One Near · Rapture","Explore the best places to learn to surf and start your surfing journey today! Ready to experience the thrill of catching your first wave?",,,"Published","Missing"
"https://www.rapturecamps.com/blog/8-reasons-why-bali-is-one-of-the-best-surfing-destinations-in-the-world/","https://www.rapturecamps.com/de/blog/8-grunde-warum-bali-eine-der-besten-surf-destinationen-der-welt-ist/","Why Bali is the World's Best Surf Destination · Rapture","Looking for a dynamic surfing destination with a large variety of breaks to suit any level of surfer? Find out why Bali is one of the Best Surfing Spot.","Bestes Surfziel der Welt - Bali · Rapture","Auf der Suche nach einem Surfziel mit einer großen Vielfalt an Breaks passend für jedes Surfer Niveau? Entdecke hier die besten Wellen - Surfziel Bali","Published","Published"
"https://www.rapturecamps.com/blog/expert-travels-tips-first-learn-to-surf-trip-to-bali/",,"8 Travel Tips for Your First Surf Trip to Bali · Rapture","Planning your first surf trip in Bali? Explore top surf spots, insider insights, accommodations, and more.",,,"Published","Missing"
"https://www.rapturecamps.com/blog/8-reasons-why-you-need-to-book-a-surf-camp-in-nicaragua-right-now/",,"8 reasons why you need to book a surf camp in Nicaragua right now",,,,"Draft","Missing"
"https://www.rapturecamps.com/blog/things-to-do-in-taghazout/",,"9 Awesome Things to do in Taghazout, Morocco · Rapture","Looking for things to do in Taghazout? Here's our list of the top 9 most awesome things to experience while staying at our Banana Village.",,,"Published","Missing"
"https://www.rapturecamps.com/blog/9-tips-to-help-you-plan-the-perfect-surf-trip-to-costa-rica/","https://www.rapturecamps.com/de/blog/9-tips-fur-die-planung-deines-costa-rica-traumurlaubs/","9 Expert Tips for a Memorable Surf Trip in Costa · Rapture","Looking for the best surf beaches in Costa Rica? Get ready for an epic adventure with these nine expert tips for a memorable surf trip.","Perfekter Surf-Urlaub in Costa Rica · Rapture","Wir haben dir eine Liste mit Tips und Tricks für die Vorbereitung deines Costa Rica Urlaubs zusammengestellt. 9 Top-Surf Camp Tips","Published","Published"
"https://www.rapturecamps.com/blog/9-reasons-to-learn-to-surf-in-costa-rica/","https://www.rapturecamps.com/de/blog/surfen-lernen-in-costa-rica-9-grunde/","9 Reasons to go Surfing in Costa Rica Surf · Rapture","Make Costa Rica your next surfing destination. From beginner-friendly breaks to challenging reef breaks, this tropical haven has it all.","Abenteuer: Surfen lernen in Costa Rica · Rapture","Du möchtest in Costa Rica Surfen lernen? Dieses mittelamerikanische Land bietet alle Zutaten für dein episches Surf-Abenteuer. 9 Argumente um zu buchen.","Published","Published"
"https://www.rapturecamps.com/blog/9-things-you-should-know-before-you-start-surfing/",,"9 Things You Should Know Before You Start Surfing",,,,"Draft","Missing"
"https://www.rapturecamps.com/blog/surf-tips-beginners/","https://www.rapturecamps.com/de/blog/surf-tipps-fuer-anfaenger/","9 Actionable Tips for Beginner Surfers · Rapture","Ready to catch your first wave? Check out these 9 easy tips for beginner surfers to help you build a strong foundation in the sport.","Hilfreiche Surf-Lern Tipps für Anfänger · Rapture","Du möchtest Surfen lernen? Lies die wichtigsten Tipps für Surf Anfänger und eigne dir das essentielle Surf Wissen an!","Published","Published"
"https://www.rapturecamps.com/blog/types-of-surf-breaks/",,"4 Important Types of Breaks: Surf Theory for · Rapture","This comprehensive guide breaks down the four main types of breaks and provides insights into how they influence wave quality and shape.",,,"Published","Missing"
"https://www.rapturecamps.com/blog/basics-to-read-a-wave/",,"Learn the Basics to Read Waves: Surfing 101 · Rapture","Want to level up your surfing game? This guide will teach you the essential skills needed to master the skill of reading waves",,,"Published","Missing"
"https://www.rapturecamps.com/blog/a-guide-to-different-types-of-surfboards/",,"A Guide To Different Types of Surfboards · Rapture","Longboard? Shortboard? Let's dive into the different types of surfboards and uncover the secrets to finding your perfect match.",,,"Published","Missing"
"https://www.rapturecamps.com/blog/surfing-the-gili-islands/","https://www.rapturecamps.com/de/blog/surfen-auf-den-gili-inseln/","Surfing Gili Islands: Know When and Where to Go · Rapture","Find out the ideal surfing conditions and the must-visit spots for surfing Gili Islands. Get ready for an epic adventure!","Menschenleere Wellen auf den Gili-Inseln · Rapture","Bist du bereit für ein südostasiatisches Abenteuer? Erfahre mehr über das Surfen auf den Gili-Inseln und entdecke Wellen mit nur wenig weiterem Publikum.","Published","Published"
"https://www.rapturecamps.com/blog/a-quiet-new-years-eve-ideas/",,"A Quiet New Year’s Eve? Here's how you can do it! · Rapture","Skip the crowds and noise this New Year's Eve. Find out how to have a quiet New Year's eve with these tips!",,,"Published","Missing"
"https://www.rapturecamps.com/blog/a-special-visitor-at-our-surfcamp-in-nicaragua/",,"A Special Visitor At Our Surfcamp In Nicaragua · Rapture","A visit from out partner to our amazing surfcamp in Nicaragua (San Juan del Sur)",,,"Published","Missing"
"https://www.rapturecamps.com/blog/how-to-pop-up-on-a-surfboard/","https://www.rapturecamps.com/de/blog/eine-schritt-fuer-schritt-anleitung-wie-man-auf-einem-surfbrett-aufsteht/","A Step-by-Step Guide On How To Pop Up On A · Rapture","Popping up on a surfboard is the make-or-break moment. Here's how to transition smoothly from prone to standing, with style!","Eine Schritt für Schritt-Anleitung, wie man auf einem Surfbrett aufsteht · Rapture","Das Aufstehen auf dem Surfbrett ist der entscheidende Moment. Hier erfährst du, wie du den Übergang von der Bauchlage zum Stehen mit Stil meisterst!","Published","Published"
"https://www.rapturecamps.com/blog/a-surfers-guide-to-balis-temples/",,"A Surfer's Guide to Bali's Temples · Rapture","So, are you curious about the best Bali temples to visit and how to respect local customs? Check out this guide to find out more!",,,"Published","Missing"
"https://www.rapturecamps.com/blog/rapturecamps-response-to-coronavirus/",,"Rapturecamps response to COVID-19 · Rapture","Don’t panic. Rapturecamps have your back. Check out our latest article for details as to our operations during the Covid-19 pandemic.",,,"Published","Missing"
"https://www.rapturecamps.com/blog/affordable-surf-towns-to-live-as-a-surfer/",,"Affordable Surf Towns: Where To Live On A Budget · Rapture","From Southeast Asia to Portugal, we cover the most affordable surf towns to ride the waves on a budget. Find out more!",,,"Published","Missing"
